,url,title,abstract,date
290,http://www.hurriyet.com.tr/gundem/foseptik-cinayeti-sanigindan-kan-donduran-sozler-41921071,Foseptik cinayeti sanığından kan donduran sözler,"ANTALYA'da kayıp olarak aranırken öldürüldüğü ortaya çıkan ve foseptikte parçalanmış cesedi bulunan Süleyman Eken'in (54) cinayet sanıkları Oktay (51) ve Mehmet Yılmaz (46) kardeşler ilk kez hakim karşısına çıktı. İşlediği cinayeti anlatan Oktay Yılmaz, “Süleyman'ın cesedini bıçakla kesmeye çalıştım. Olmayınca ağaç testeresi ile kol ve bacaklarını ayırdım. Naylon poşetlere parçaları koydum. Gövde ve baş kısmını konteynere attım"" dedi.",20.10.2021
291,http://www.hurriyet.com.tr/gundem/gocmen-sagligi-merkezinde-doktor-dehset-sacti-meslektasini-oldurdu-41921021,Göçmen sağlığı merkezinde doktor dehşet saçtı! Meslektaşını öldürdü,"Mersin'de Mezitli Güçlendirilmiş Göçmen Sağlığı Merkezi'nde görevli Dr. Hasan Çayır, daha önce tartıştığı&nbsp;Dr. Ahmet Dikmen'i tüfekle vurdu. Ağır yaralanan Dikmen, kaldırıldığı Mersin Üniversitesi Tıp Fakültesi Hastanesi'nde hayatını kaybetti.",20.10.2021
292,http://www.hurriyet.com.tr/gundem/liseli-borani-bicaklayarak-oldurmustu-yakalandi-41920868,Liseli Boran'ı bıçaklayarak öldürmüştü! Yakalandı,"Aydın'ın Kuşadası ilçesinde, okul arkadaşı Boran Sönmez'i (16) göğsünden bıçaklayarak öldüren lise öğrencisi Z.K. polis tarafından yakalandı. Gözaltına alınan şüpheli, emniyetteki işlemlerinin ardından sevk edildiği adliyede tutuklandı.&nbsp;",20.10.2021
293,http://www.hurriyet.com.tr/gundem/cifte-cinayetin-sirri-ozel-bir-ekip-arastiriyor-41920670,Çifte cinayetin sırrı... Özel bir ekip araştırıyor,"Avcılar’da otel sahibi Nuri Yıldız’ın otomobilde, eşi Esra Yıldız’ın ise evde öldürülmesiyle ilgili polis iki kişinin peşinde. Adli Tıp ise Nuri Yıldız’ın karısından önce öldürüldüğünü ortaya çıkarttı.",20.10.2021
294,http://www.hurriyet.com.tr/gundem/okul-arkadasi-tarafindan-oldurulmustu-boranin-cenazesini-ailesi-teslim-aldi-41920428,Okul arkadaşı tarafından öldürülmüştü! Boran'ın cenazesini ailesi teslim aldı,"Aydın'ın Kuşadası ilçesinde, okul arkadaşı Z.K. (17) tarafından göğsünden bıçaklanarak öldürülen lise öğrencisi Boran Sönmez'in (16) cenazesi ailesi tarafından İzmir Adli Tıp Kurumu morgundan teslim alındı. Olayın ardından kaçan Z.K.'yı yakalamak için çalışmaların sürdüğü bildirildi.",19.10.2021
295,http://www.hurriyet.com.tr/gundem/erdogan-da-iddialarin-arastirilmasini-istedi-henuz-gelen-istihbarat-yok-41920016,Erdoğan da iddiaların araştırılmasını istedi! Henüz gelen istihbarat yok,“Siyasi cinayetler işlenebilir” iddiaları üzerine başlatılan soruşturmada Cumhurbaşkanı Tayyip Erdoğan da savcılığa başvurarak araştırma yapılmasını istedi. Soruşturma kapsamında savcılığın yazı yazdığı MİT ve Emniyet’ten henüz bir tespit paylaşılmadığı belirtildi.,19.10.2021
296,http://www.hurriyet.com.tr/gundem/anne-ve-babasinin-cesetleri-tandirda-bulunmustu-kan-donduran-sozler-41919946,Anne ve babasının cesetleri tandırda bulunmuştu... Kan donduran sözler!,"Kayseri’de, Mehmet Turhan (55) ve boşandıktan sonra birlikte yaşamaya devam ettiği eşi Firdevs Öztürk (52) çiftini iple boğarak öldürüp ardından da kuyuya gömen kardeşi Yusuf Turhan (52) ile oğlu Bedirhan ve eşi Nejla Turhan'ın yargılanmasına devam edildi. Duruşmada ölen çiftin oğlu Yusuf Turhan, aynı ismi taşıdığı amcasının kendisini de öldürmeye çalıştığını belirterek, ""Karakola giderken amcam Yusuf ve yengem Nejla peşimden geldi. Ardından da annem ve babamı katlettikleri eve götürdüler. Evi gezdirmek istediler. Amcam, 'bu gece gel burada kal' dedi. Annem ve babamı katlettiği evde beni de öldürüp, ortadan kaldırmak istedi"" dedi.",18.10.2021
297,http://www.hurriyet.com.tr/gundem/son-dakika-cumhurbaskani-erdogandan-kilicdarogluna-suc-duyurusu-41919866,Son dakika: Cumhurbaşkanı Erdoğan'dan Kılıçdaroğlu'na suç duyurusu!,"Cumhurbaşkanı Recep Tayyip Erdoğan'ın avukatları, CHP Genel Başkanı Kemal Kılıçdaroğlu'nun bürokratlarla ilgili açıklamasında, Erdoğan'a yönelik hakaret içeren ifadelerin de yer aldığı gerekçesiyle suç duyurusunda bulundu.",18.10.2021
298,http://www.hurriyet.com.tr/gundem/siyasi-cinayetler-iddiasi-iyi-partili-koray-aydin-savciya-telefonla-bilgi-verdi-41919774,‘Siyasi cinayetler’ iddiası! İYİ Partili Koray Aydın savcıya telefonla bilgi verdi,"""Siyasi cinayet"" iddiaları nedeniyle başlatılan soruşturma kapsamında İYİ Parti Teşkilatlardan Sorumlu Genel Başkan Yardımcısı Koray Aydın savcıya telefonla bilgi verdi. ",18.10.2021
299,http://www.hurriyet.com.tr/gundem/afyonkarahisarda-topraga-gomulu-ceset-parcalari-bulundu-41919696,101 gün sonra toprağa gömülü cesedi bulundu,"Afyonkarahisar'da hayvan otlatan çobanın arazide kafatası görüp jandarmaya ihbarı üzerine yapılan kazıda, erkek cesedi bulundu. Cesedin üzerindeki giysinin cebinden 101 gündür kendisinden haber alınamayan Osman Gönk'e (40) ait banka ve kimlik kartı çıktı.",18.10.2021
300,http://www.hurriyet.com.tr/gundem/son-dakika-siyasi-cinayet-iddiasi-cumhurbaskani-erdogandan-ankara-cumhuriyet-bassavciligina-basvuru-41919531,Son dakika... 'Siyasi cinayet' iddiası! Cumhurbaşkanı Erdoğan'dan Ankara Cumhuriyet Başsavcılığı'na başvuru,"Cumhurbaşkanı Recep Tayyip Erdoğan'ın avukatları, 'siyasi cinayet' iddialarına ilişkin Ankara Cumhuriyet Başsavcılığı'na başvuruda başvurarak, söz konusu iddialarla ilgili gerekli incelemenin yapılmasını istedi.",18.10.2021
301,http://www.hurriyet.com.tr/gundem/dugunde-akraba-teroru-1-olu-damat-dahil-5-yarali-41919305," Düğünde akraba terörü: 1 ölü, damat dahil 5 yaralı","İzmir’in Bornova ilçesi Kemalpaşa Mahallesi 7033 Sokak’taki salonda önceki gece Alican Ö. ile&nbsp;Nursena C. çiftinin düğününe çok sayıda davetli katıldı. İlerleyen saatlerde, bitişik tarlalarına çekilen duvar nedeniyle aralarında husumet bulunan damat tarafının akrabaları arasında tartışma çıktı.",18.10.2021
302,http://www.hurriyet.com.tr/gundem/izmirde-kanli-dugun-1-olu-damat-dahil-5-yarali-41918821,"İzmir'de kanlı düğün! 1 ölü, damat dahil 5 yaralı","İzmir'in Bornova ilçesinde aralarında arazi anlaşmazlığı nedeniyle husumet bulunan akraba iki aile düğün salonunda karşılaşınca ortalık savaş alanına döndü. Çıkan&nbsp;bıçaklı kavgada 1 kişi hayatını kaybetti, aralarında damadın da bulunduğu 5 kişi yaralandı. Davetlilerin panik ve korku yaşadığı olayla ilgili 1 kişi gözaltına alındı.",17.10.2021
303,http://www.hurriyet.com.tr/gundem/rogar-kapagi-cinayetinde-25-yil-hapis-cezasi-alan-supheli-yakalandi-41918681,Hapis cezası kesinleşti! 14 yıl sonra cezaevine gönderildi,İstanbul'un Küçükçekmece ilçesinde 2007 yılında açık unutulan rögar çukuru yüzünden meydana gelen cinayet olayında Abdullah Kurt’un öldürülmesiyle ilgili yargılandıktan sonra 25 yıl hapis cezası kesinleşen Recep S. (60) Bahçelievler’de düzenlenen operasyonla gözaltına alındı. Recep S. cezasını çekmek üzere cezaevine teslim edildi.,16.10.2021
304,http://www.hurriyet.com.tr/gundem/her-satiri-vahset-iskence-yapip-oldurdukten-sonra-yakmislar-41918367,Her satırı vahşet! İşkence yapıp öldürdükten sonra yakmışlar,"İzmir'de 3&nbsp;sene önce öldürülen Özler Yörük'ün (33) cinayet şüphelisinin,&nbsp;kendisine fuhuş yaptırdığı ileri sürülen, eski erkek arkadaşı Olcay Altundağ (31) olduğu belirlendi.&nbsp;Altundağ ve beraberindekilerin,&nbsp;Yörük'ün&nbsp;üzerine kaynar su dökerek,&nbsp;3 gün boyunca işkence yaptığı tespit edildi.&nbsp;Boğularak öldürüldükten&nbsp;sonra ormanda yakıldığı saptanan&nbsp;Yörük cinayetiyle ilgili gözaltına alınan 13 şüpheliden, başka suçtan cezaevinde bulunan Altundağ ile 4 kişi tutuklandı.",16.10.2021
305,http://www.hurriyet.com.tr/gundem/erdogandan-suriye-mesaji-mucadelemiz-cok-farkli-seyredecek-41918200,Erdoğan’dan Suriye mesajı: Mücadelemiz çok farklı seyredecek,"Cuma namazı çıkışı konuşan Cumhurbaşkanı Erdoğan, ‘Suriye’ye yeni harekât olacak mı’ sorusuna, “Mücadelemiz bundan sonraki süreçte çok daha farklı bir şekilde devam edecek. Terör örgütlerine, Amerika’nın oradaki malum güçlerine, rejim güçlerine karşı gerekli olan her türlü mücadeleyi vereceğiz, kararlıyız” yanıtını verdi. ",16.10.2021
306,http://www.hurriyet.com.tr/gundem/toreniz-batsin-geride-acili-bir-es-ve-7-cocugu-kaldi-41918209,Töreniz batsın: Geride acılı bir eş ve 7 çocuğu kaldı,"Facebook’tan tuzak kurularak öldürülen Kamuran Tün’ün cenazesi Şırnak’ta toprağa verildi. Töre nedeniyle işlenen cinayetten geriye, Kamuran Tün’ün eşi ve 7 çocuğunun cenaze evinde çekilen bu çaresiz fotoğrafı kaldı. Kamuran Tün’ün kardeşi Nurettin Tün, “Bu töre cinayetleri artık bitsin. Arkada 7 yetim çocuk bıraktılar, bunların vebali kimin boynuna” dedi.",16.10.2021
307,http://www.hurriyet.com.tr/gundem/siyasi-cinayetler-sorusturmasi-kilicdaroglu-ve-aydin-ifadeye-davet-edildi-41918217,Siyasi cinayetler soruşturması: Kılıçdaroğlu ve Aydın ifadeye davet edildi,"Muhalefetin “Siyasi cinayetler işlenebilir” iddiası üzerine Ankara Cumhuriyet Başsavcılığı tarafından başlatılan soruşturma kapsamında, Kemal Kılıçdaroğlu ve Koray Aydın bilgilerine başvurulmak üzere ifade vermeye davet edildi.",16.10.2021
308,http://www.hurriyet.com.tr/gundem/emekli-polis-memuru-dehset-sacti-2-olu-41918157,Emekli polis memuru dehşet saçtı: 2 ölü,Adana'da emekli polis memuru kahvehanede tartıştığı 2 kişiyi silahla vurarak öldürdü. Polis ekipleri zanlı Kamil G'yi gözaltına aldı.,15.10.2021
309,http://www.hurriyet.com.tr/gundem/tbmm-baskani-sentoptan-siyasi-cinayet-iddialariyla-ilgili-aciklama-turkiyede-boyle-bir-ortama-musaade-edilmez-41918127,TBMM Başkanı Şentop'tan 'siyasi cinayet' iddialarıyla ilgili açıklama: Türkiye'de böyle bir ortama müsaade edilmez,"TBMM Başkanı Mustafa Şentop, siyasi cinayetler işlenebileceği iddialarıyla ilgili, ""Doğru bilgi varsa, somut bilgi varsa bunun intikal ettirileceği yerler emniyet, güvenlik güçleri ve savcılıklardır. Onlar gerekeni yaparlar. Böyle bir ortam yok Türkiye'de ve böyle bir ortama müsaade edilmez."" dedi.",15.10.2021
310,http://www.hurriyet.com.tr/gundem/kadikoydeki-tore-cinayetinde-yeni-goruntuler-41917968,Kadıköy'deki töre cinayetinde yeni görüntüler,"İstanbul'un Kadıköy ilçesinde Murat Timuçin, 20 yıl önce annesiyle aşk yaşadığını iddia ettiği Kamuran Tün'ü (42) sokak ortasında bıçaklayarak öldürmüş, olayla ilgili 4 kişi gözaltına alınmıştı. Öldürülen Kamuran Tün'ün kardeşi iddiaları yalanlarken, cinayet sonrası yaşananlara dair cep telefonu görüntüleri ortaya çıktı. Yaşananların ardından Kamuran Tün'ün kardeşi Nurettin Tün, 'Dün değil öbür gün Kadıköy'ün ortasında kardeşim Kamuran Tün, 4 kişi tarafından pusu kurularak vahşice katledildi. Planlı ve canavar hislerle kardeşimi öldürdüler.' dedi.",15.10.2021
311,http://www.hurriyet.com.tr/gundem/gamze-pala-cinayetinde-karar-cikti-ablalari-gozyaslarina-boguldu-41917965,Gamze Pala cinayetinde karar çıktı! Ablaları gözyaşlarına boğuldu,"Rize'nin Fındıklı ilçesinde Gamze Pala’yı (46) aşkına karşılık vermediği gerekçesiyle tabancayla sırtından vurduktan sonra boğazını bıçakla keserek öldüren Savaş Dalançıkar (39), 'tasarlayarak kasten öldürme' suçundan 'ağırlaştırılmış müebbet hapis' cezasına çarptırıldı. Mahkeme heyeti cezada indirim uygulamadı. Duruşma sonrası Gamze Pala'nın ablaları Tülay Pala ve Fatma Serdar gözyaşlarını tutamadı.",15.10.2021
312,http://www.hurriyet.com.tr/gundem/dna-bankasi-yenilendi-omerin-yanlislikla-olduruldugu-ortaya-cikti-41917875,"DNA bankası yenilendi, Ömer'in yanlışlıkla öldürüldüğü ortaya çıktı","İstanbul'un Mecidiyeköy ilçesinde 2019 yılında bir kahvehanenin silahla taranarak 17 yaşındaki Ömer Çakmak'ın öldürülmesinin yanlışlıkla olduğu belirlendi. Polis dosyasına göre şüphelilerin birlikte yasa dışı bahis işi yaptıkları, ancak bir alacak verecek meselesi yüzünden aralarında husumet oluştuğu tespit edildi.",15.10.2021
313,http://www.hurriyet.com.tr/gundem/avcilardaki-evinde-esi-oldurulen-kayip-otelcinin-cesedi-bulundu-41917544,Avcılar'daki evinde eşi öldürülen kayıp otelcinin cesedi bulundu,"Avcılar'daki evinde boğazı kesilerek öldürülen Esra Yıldız'ın kayıp olarak aranan eşi Nuri Yıldız, Beylikdüzü'nde başına bir el ateş edilerek öldürülmüş halde bulundu.",15.10.2021
314,http://www.hurriyet.com.tr/gundem/tartistigi-kisiyi-av-tufegi-ile-basindan-vurarak-oldurdu-41917490,Tartıştığı kişiyi av tüfeği ile başından vurarak öldürdü,"İzmir'in Buca ilçesinde, tartıştığı kişi tarafından av tüfeği ile başından vurulan Hamdi Amasya (32), kaldırıldığı hastanede yaşamını yitirdi. Amasya'yı vuran cinayet zanlısı K.D. ise polis tarafından gözaltına alındı.",15.10.2021
315,http://www.hurriyet.com.tr/gundem/kadikoydeki-tore-cinayetinde-ifadeler-ortaya-cikti-tum-detaylari-anlatti-41917045,Kadıköy'deki töre cinayetinde ifadeler ortaya çıktı! Tüm detayları anlattı,"Kadıköy'de 20 yıl önce annesiyle aşk yaşadığını iddia ettiği Kamuran Tün'ü (42) sokak ortasında bıçaklayarak öldüren Murat T. (21) ile birlikte gözaltına alınan 4 şüphelinin mahkemedeki ifadesi ortaya çıktı. Murat T., annesiyle maktulün 20 yıl önce ilişki yaşadığını öğrendiğini, Şırnak'tan İstanbul'a öldürmek amacıyla geldiğini, cinayeti işleyeceğini kimsenin bilmediğini iddia ettiği öğrenildi. Diğer şüpheliler de cinayetle bir ilgilerinin olmadığını iddia ederek suçlamayı reddetti.",14.10.2021
316,http://www.hurriyet.com.tr/gundem/diyarbakirda-iscisini-oldurdu-polis-ikna-ederek-gozaltina-aldi-41917032,"Diyarbakır'da işçisini öldürdü, polis ikna ederek gözaltına aldı","DİYARBAKIR’da, K.K. (33), evine çağırıp birlikte içki içtiği işçisi Bünyamin Yavuz’u (23) aralarında çıkan tartışmada tabancayla 4 el ateş ederek öldürdü. K.K., daha sonra eşi S.K.'ya (26) da ateş etti. Genç kadın yangın merdiveninden kaçarak saldırıdan yara almadan kurtulurken, polisin ikna çabası sonucu teslim olan K.K., gözaltına alındı.",14.10.2021
317,http://www.hurriyet.com.tr/gundem/polis-memuru-sultan-tatin-intihar-ettigi-iddia-ediliyordu-sevgilisine-cinayetten-25-yil-hapis-cezasi-verildi-41916978,Polis memuru Sultan Tat'ın intihar ettiği iddia ediliyordu! Sevgilisine cinayetten 25 yıl hapis cezası verildi,"Antalya'da silahla intihar ettiği iddia edilen polis memuru Sultan Tat'ın (39) erkek arkadaşı emekli polis memuru Ferdağ Aladağ, cinayet suçundan 25 yıl hapse mahkum edildi. Anne Emine Tat, 'Adaletin yerini bulduğunu' ancak 2 ay önce ölen eşinin davanın sonucunu görememesine üzüldüğünü söyledi.",14.10.2021
318,http://www.hurriyet.com.tr/gundem/son-dakika-icisleri-bakani-soylu-sosyal-medyada-manipule-edenlerin-yuzde-69u-bot-hesaplardir-41916943,Son dakika: İçişleri Bakanı Soylu: Sosyal medyada manipule edenlerin yüzde 69'u bot hesaplardır,"İçişleri Bakanı Süleyman Soylu, İstanbul Galata Üniversitesi Akademik Yılı Açılış Töreni'nde konuştu. Soylu 'siyasi cinayetler' tartışmasına ilişkin, 'Bir siyasi cinayetler tartışması vardı. Buradan Türkiye'ye sesleniyorum. Sosyal medyada 'siyasi cinayetler' tartışmasını manipüle edenlerin yüzde 69'u bot hesaplardır. Dünyada bunu birkaç yabancı yapar bir de biz yaparız. Yine buradan söyleyeyim dünyadaki tüm ülkelerle yarışmaya hazırız' ifadelerini kullandı.",14.10.2021
319,http://www.hurriyet.com.tr/gundem/basaksehirde-korkunc-olay-annesine-siddet-uygulayan-babasini-oldurdu-41916889,Başakşehir'de korkunç olay! Annesine şiddet uygulayan babasını öldürdü,"Başakşehir'de üniversite öğrencisi B.Ç. (21), annesine şiddet uyguladığını iddia ettiği babası Ömer Sedat Ç.'yi (47) silahla bir el ateş ederek öldürdü. B.Ç. olayda kullandığı silahla polis merkezine giderek teslim oldu. ",14.10.2021
320,http://www.hurriyet.com.tr/gundem/olumune-takip-41916676,Ölümüne takip! Katiller Facebook ile geldi,"Murat Tumuçin (21), annesiyle aşk yaşayan Tün’ün izini Facebook’ta buldu, akrabalarıyla plan yaptı. Önce Züleyha ismiyle Tün’le sohbet etti, daha sonra buluşmaları için bir kadın ayarladı. Tumuçin, restoranda kadınla buluştuktan sonra takip ettiği Tün’ü Kadıköy’de sokak ortasında bıçaklayarak öldürdü. Tumuçin ve babası tutuklandı.",14.10.2021
321,http://www.hurriyet.com.tr/gundem/kadir-sekere-iyi-haber-41916678,Kadir Şeker'e iyi haber,"Konya’da, sokakta sevgilisi Ayşe Dırla’yı döven Özgür Duran’a engel olmaya çalışırken cinayet işleyen Kadir Şeker 12 yıl 6 ay hapis cezası almıştı. Yargıtay Cumhuriyet Başsavcılığı cezanın fazla olduğu yönünde görüş belirterek kararın bozulmasını istedi. Şimdi gözler Yargıtay 1. Ceza Dairesi’nin vereceği kararda.",14.10.2021
322,http://www.hurriyet.com.tr/gundem/emniyet-ve-mitte-siyasi-cinayet-duyumu-yok-41916717,‘Emniyet ve MİT’te siyasi cinayet duyumu yok’,"İçişleri Bakanı Soylu, ‘siyasi cinayetler olabilir’ açıklamasıyla ilgili, “Bakan yardımcıma, bir siyasi partinin genel başkan yardımcısını arattırdım. Kılıçdaroğlu’nun değerlendirmesiyle hareket ettim, konuşmalardan hareket ettim’ denildi” yanıtını verdi.",14.10.2021
323,http://www.hurriyet.com.tr/gundem/siyasi-cinayet-iddialarina-sorusturma-41916713,‘Siyasi cinayet’ iddialarına soruşturma,"CHP Lideri ve bazı muhalif milletvekillerinin, “siyasi cinayetler işlenebilir” iddiasıyla ilgili olarak Ankara Cumhuriyet Başsavcılığı harekete geçerek, resen soruşturma başlattı. Savcılık, Emniyet ve MİT’e yazı yazarak, iddialarla ilgili olarak ellerinde herhangi bir istihbarat bulunup bulunmadığını sordu ve iddiaların araştırılması talimatı verdi.",14.10.2021
324,http://www.hurriyet.com.tr/gundem/basbakan-geliyor-dedi-41916716,‘Başbakan geliyor’ dedi,"Meclis kürsüsünden ‘Sıkı dur başbakan  geliyor’ diye seslenen İYİ Parti Genel  Başkanı Akşener “İYİ Parti artık, Türkiye’nin, ‘de facto’ (fiili) iktidar partisidir. Biz milletimizle omuz omuzayız” ifadelerini kullandı. ",14.10.2021
325,http://www.hurriyet.com.tr/gundem/muharrem-ince-cnn-turkte-acikladi-kilicdaroglu-aday-olmalidir-41916636,Muharrem İnce CNN TÜRK'te açıkladı: Kılıçdaroğlu aday olmalıdır,"Memleket Partisi Genel Başkanı Muharrem İnce, Ahmet Hakan'ın moderatörlüğünde gerçekleşen Tarafsız Bölge programında Melik Yiğitel ve Hakan Bayrakçı'nın sorularını yanıtladı. 2023 seçimleri öncesi partilerin adaylarıyla ilgili düşüncesini dile getiren Muharrem İnce, ""Bence CHP’nin adayı sayın Kılıçdaroğlu olmalıdır, yakışanı odur. İYİ Parti’nin adayı da Meral hanım olmalıdır."" dedi. Ayrıca İnce, ""Eğer 19 yılın sonunda Erdoğan kazanıyorsa o zaman herkes şapkasını önüne alıp düşünsün."" ifadelerini kullandı.",13.10.2021
326,http://www.hurriyet.com.tr/gundem/kadikoyde-korkunc-tore-cinayeti-babasi-ve-amcasiyla-plan-yapmis-20-yil-sonra-41916507,Kadıköy'de korkunç töre cinayeti! Babası ve amcasıyla plan yapmış: 20 yıl sonra...,"Şırnak'ta dedesiyle yaşayan Murat T. isimli şahıs, 20 yıl önce ailenin korkusundan Irak'a kaçan annesiyle yasak aşk yaşayan Kamuran Tün'ü öldürmek için babası ve amcasıyla birlikte plan yaptı. Murat T., Kamuran Tün'ü sokak ortasında defalarca bıçaklayarak öldürdü. Şüpheli Murat Timuçin ile babası Hacı Timuçin çıkarıldıkları mahkemece tutuklandı. Cinayetin hemen sonrasında yaşananlar güvenlik kameralarına saniye saniye yansıdı. ",13.10.2021
327,http://www.hurriyet.com.tr/gundem/cocukluk-arkadasini-uyurken-oldurmustu-muebbet-hapse-carptirildi-41916416,Çocukluk arkadaşını uyurken öldürmüştü! Müebbet hapse çarptırıldı,"Bursa’da, yatağında uyuyan çocukluk arkadaşı Emrah Arslanoğlu'nu (24) 13 yerinden bıçaklayarak öldürdüğü iddiasıyla tutuklu yargılanan Ahmet Babur (25), ağırlaştırılmış müebbet hapis cezasına çarptırıldı. Takdir indirimi uygulayan mahkeme heyeti, cezayı müebbet hapse çevirdi.",13.10.2021
328,http://www.hurriyet.com.tr/gundem/antalyada-eglence-merkezinde-dehset-cinayet-sanigindan-tepki-ceken-hareket-41916218,Antalya'da eğlence merkezinde dehşet! Cinayet sanığından tepki çeken hareket,"Antalya'da Gökhan Demirtaş'ı (23) bıçaklayarak öldüren Metehan Kurtulget (25), ilk kez hakim karşısına çıktı. Tanıklar dinlenirken gülen sanığa, Demirtaş'ın anne ve babası tepki gösterdi. Kurtulget, 'Ben olay günü 25'e yakın kadına dans teklifinde bulundum. Maktulün arkadaşlarının bulunduğu masadaki kıza da 5 kez dans teklifi yaptım. Ancak kabul etmedi. Bardan bıçak alıp geldim.' şeklinde konuştu.",13.10.2021
329,http://www.hurriyet.com.tr/gundem/son-dakika-siyasi-cinayetler-sorusturmasi-ankara-cumhuriyet-bassavciligi-resen-sorusturma-baslatti-41916117,Son dakika... 'Siyasi cinayet' iddiasına resen soruşturma! Bakan Soylu: Bu bir FETÖ taktiğidir,"Ankara Cumhuriyet Başsavcılığı, bazı siyasetçilerin basın organlarına yansıyan ""siyasi cinayetler işlenebileceği"" iddialarıyla ilgili resen soruşturma başlattı. İçişleri Bakanı Süleyman Soylu, iddialarla ilgili olarak ""İçişleri Bakanıyım sordum; böyle bir siyasi cinayet istihbaratı var mı, yok. Bu bir FETÖ taktiğidir"" dedi.&nbsp;",13.10.2021
330,http://www.hurriyet.com.tr/gundem/infaz-koruma-memurundan-ilginc-savunma-41916108,İnfaz koruma memurundan ilginç savunma,"BOLU'da, mahkumlara uyuşturucu madde sattığı iddiasıyla 15 yıl hapis cezası istemiyle tutuksuz yargılanan infaz koruma memuru Yaşar S., kendisine A.T. isimli cinayet hükümlüsünün iftira attığını söyledi. Hannibal gibi A.T.’nin insan eti yediğini öne süren Yaşar S. savunmasında, ""A.T. hep sorun çıkaran bir mahkumdur. Bildiğim kadarıyla A.T., meyve bıçağı ile bacağından et kopartıp, cezve içerisinde pişirip yiyen, ayrıca boğazını kesip parmağını boğazına sokan birisidir. O yüzden kendisine itibar edilmemesi gerekir"" dedi.",13.10.2021
331,http://www.hurriyet.com.tr/gundem/kayinpeder-degil-canavar-gelinini-parcalayip-cop-kovasi-ve-otomobilin-bagajina-koydu-41915886,"Kayınpeder değil canavar! Gelinini parçalayıp, çöp kovası ve otomobilin bagajına koydu","Tekirdağ’ın Çerkezköy ilçesinde Fehmi A. (65), tartıştığı Kırgızistan uyruklu gelini Ayat A.’yı (31) bıçaklayarak öldürüp, vücudunu parçalara ayırdı. Parçalanan vücudun bir kısmı&nbsp;evin banyosundaki çöp kovası ve poşetler halinde otomobilin bagajında bulundu.",12.10.2021
332,http://www.hurriyet.com.tr/gundem/istanbulda-sir-olay-kayip-otelci-her-yerde-araniyor-41915527,İstanbul'da sır olay! Kayıp otelci her yerde aranıyor,İstanbul'un Avcılar ilçesinde Esra Yıldız boğazı kesilerek öldürüldü. Kocası Nuri Yıldız’ın ise aracı yakıldı. Araçta bulunan kan izinin Esra Yıldız’a ait olmadığı belirlendi. Polis kayıp olan Nuri Yıldız öldürüldü mü yoksa kaçtı mı sorusuna cevap arıyor. Öte yandan Esra Yıldız'ın (38) cenazesi toprağa verildi. Yıldız'ın cenaze namazından sonra tabutu kadınlar tarafından omuza alınarak taşındı.,12.10.2021
333,http://www.hurriyet.com.tr/gundem/kendini-yaralayan-arkadasinin-ikizini-kana-kan-isteriz-diyerek-oldurtmus-41915357,Kendini yaralayan arkadaşının ikizini 'Kana kan isteriz' diyerek öldürtmüş,"Adana’da kuru yemiş dükkanında uğradığı silahlı saldırıda yaşamını yitiren Eren Teyyare’nin (30) katil zanlısı Selçuk Yiğit Mukyen (19) ve motosikleti kullanan Sercan Çelik (25) ile cinayeti azmettirip planladığı öne sürülen 9 şüpheli yakalandı. Eren Teyyare’nin ikiz kardeşi Emre Teyyare’nin (30), bir tahsilat işinde parasını vermeyip tartıştığı Volkan Ayvaz’ı (27) tabancayla yaraladığı gerekçesiyle tutuklandığı, Ayvaz ailesinin de “Kana kan isteriz” diyerek cinayeti azmettirdiği ortaya çıktı.",12.10.2021
334,http://www.hurriyet.com.tr/gundem/son-dakika-ankarada-millet-ittifaki-trafigi-bahceli-birbirlerine-tuzak-kuruyorlar-41915251,Son dakika: Ankara'da Millet İttifakı trafiği... Bahçeli: Birbirlerine tuzak kuruyorlar,"MHP Genel Başkanı Devlet Bahçeli partisinin grup toplantısında açıklamalarda bulundu. Bahçeli, ""Zillet ittifakını oluşturan partiler gün aşırı birbirlerini ziyaret ediyorlar, hava kokluyorlar ancak arka kapıda birbirlerine tuzak kuruyorlar. Bir yapmadıkları altın günleriydi, zannediyorum yakında bunu da gerçekleştirecekler"" dedi.",12.10.2021
