,url,title,abstract,date
937,http://www.hurriyet.com.tr/gundem/katilleri-18-yil-sonra-yakalandi-41762810,Katilleri 18 yıl sonra yakalandı,Alaittin Çırpan evine giren kimliği belirsiz kişiler tarafından öldürülmüştü. 18 yıl sonra Çırpan’ın katillerinin Cafer Gümüşburun ile arkadaşı İlkat Ersöz olduğu ortaya çıktı.,15.3.2021
938,http://www.hurriyet.com.tr/gundem/yaya-gecidinde-cinayet-gibi-kaza-41762780,Yaya geçidinde cinayet gibi kaza!,"Çorum’da bir maketten alışveriş yaptıktan sonra evlerine gitmek için yaya geçidinden geçmeye çalışan Ayşe Tütüncü (43) ile oğlu Engin Tütüncü (7) ve akrabası Mustafa Aksuya (41) otomobil çarptı. Kazada anne öldü, oğlu ve yakını ağır yaralandı. Polis olaydan sonra kaçan otomobil sürücüsünü arıyor.",14.3.2021
939,http://www.hurriyet.com.tr/gundem/izmirde-dehset-savunmasi-kan-dondurmustu-tutuklandi-41762766,İzmir'de dehşet! Savunması kan dondurmuştu... Tutuklandı!,"İzmir’in Bornova ilçesinde, evli olduğu Hüsna Temurtaş'ı (30) tabancayla katleden Hüseyin Temurtaş'ın (34), çıkarıldığı Sulh Ceza Hakimliğince tutuklandı. Polise verdiği ilk ifadesinde,"" İznim olmadan dışarı çıkıyordu."" demişti.",14.3.2021
940,http://www.hurriyet.com.tr/gundem/cesedi-cekyatin-icinde-bulunan-kadir-yukselin-oldurulmesine-iliskin-3-supheli-gozaltina-alindi-41762196,Cesedi çekyatın içinde bulunan Kadir Yüksel'in öldürülmesine ilişkin 3 şüpheli gözaltına alındı,"İzmir'in Bornova ilçesinde, cesedi dairesindeki çekyat içerisinde battaniyeye sarılı halde bulunan trans bireyin ölümüyle ilgili 3 şüpheli gözaltına alındı.",13.3.2021
941,http://www.hurriyet.com.tr/gundem/izmirde-koca-dehseti-korkunc-olay-silah-sesleri-uzerine-ortaya-cikti-41762181,İzmir'de koca dehşeti! Korkunç olay silah sesleri üzerine ortaya çıktı,"İzmir'in Bornova ilçesinde üç çocuk annesi Hüsna T. (30), tartıştığı eşi Hüseyin T. (34) tarafından tabancayla vurularak öldürüldü. Polis, kaçan Hüseyin T.'nin yakalanması için çalışma başlattı.",13.3.2021
942,http://www.hurriyet.com.tr/gundem/bayrampasadaki-kan-donduran-vahsette-yeni-gelisme-cinayet-oncesi-kameralari-bozmus-41762097,Bayrampaşa'daki kan donduran vahşette yeni gelişme! Cinayet öncesi kameraları bozmuş,"Bayrampaşa'da kaldığı otelde 43 yaşındaki Ferdane Kurt'u iple boğarak öldürdüğü iddiasıyla tutuklanan Cemil Yar hakkındaki soruşturma tamamlandı. Savcılıkça düzenlenen iddianamede, şüpheli Yar hakkında ""Tasarlayarak kasten öldürme"" suçundan ağırlaştırılmış müebbet hapis talep etti. İddianamede, şüphelinin kendisinin ve Ferdane Kurt'un bulunduğu katlardaki kameraları olaydan önce bozduğu da belirtildi. ",13.3.2021
943,http://www.hurriyet.com.tr/gundem/esenyurtta-sevcan-demirin-olumunde-flas-ses-kaydi-kitir-kitir-kesmezsem-insan-degilim-41761980,Esenyurt'ta Sevcan Demir'in ölümünde flaş ses kaydı... 'Kıtır kıtır kesmezsem insan değilim',"İstanbul Esenyurt'ta birlikte yaşadığı Kenan Danış ile tartıştıktan sonra evinin 4’üncü katından düşerek hayatını kaybeden Sevcan Demir olayında yeni gelişme yaşandı. Sevcan Demir'in ailesi olaydan dakikalar önce yaptıkları telefon görüşmelerini kanıt olarak sundu. Görüşmede Kenan Danış'ın ""Kıtır kıtır kesmezsem insan değilim"" dediği duyuluyor.",13.3.2021
944,http://www.hurriyet.com.tr/gundem/alzheimer-hastasi-koca-dehset-sacti-40-yillik-esini-tufekle-oldurup-intihar-etti-41761927,"Alzheimer hastası koca dehşet saçtı! 40 yıllık eşini tüfekle öldürüp, intihar etti","Aksaray'da, yakınlarının haber alamadığı Cennet Alptekin (60) ve eşi Ekrem Alptekin (61), evde tüfekle vurulmuş olarak&nbsp;ölü bulundu. Psikolojik sorunları olduğu öne sürülen, Alzheimer hastası&nbsp;Ekrem Alptekin’in ruhsatlı tüfeği ile önce 40 yıllık eşini öldürüp sonra da kendisini başından vurarak, yaşamına son verdiği&nbsp;ortaya çıktı.",13.3.2021
945,http://www.hurriyet.com.tr/gundem/corumda-ogrenci-servisinde-iki-cocugu-oldurmustu-caninin-ifadesi-ortaya-cikti-41761805,Çorum'da öğrenci servisinde iki çocuğu öldürmüştü! Caninin ifadesi ortaya çıktı,Çorum'un Alaca ilçesinde oğluyla kavga eden 8'inci sınıf öğrencisi Tunç Taşar (14) ve Kaan Hakverdi’yi okul servisinde tabancayla vurarak öldüren eski muhtar Servet Başbuş’un savcılık ifadesi ortaya çıktı. ,13.3.2021
946,http://www.hurriyet.com.tr/gundem/okul-servisinde-katliam-ogluyla-tartisan-2-cocugu-oldurdu-41761765,Okul servisinde katliam: Oğluyla tartışan 2 çocuğu öldürdü,"ÇORUM’un Alaca ilçesi İmat köyünün eski muhtarı Servet B.’nin oğlu Z.B. ile 8’inci sınıf öğrencileri Tunç Taşar (14) ve Kaan Hakverdi (13) kavga etti. Z.B., akşam eve gidince yaşananları babasına anlattı. Dün sabah Servet B., yolda durdurduğu okul servis minibüsündeki Taşar ve Hakverdi’ye tabancayla peş peşe ateş etti. ",13.3.2021
947,http://www.hurriyet.com.tr/gundem/unlulerin-hocasi-salih-memisoglunun-son-sozleri-bunlar-olmus-kati-itiraf-etti-41761285,'Ünlülerin hocası' Salih Memişoğlu'nun son sözleri bunlar olmuş! Katil itiraf etti,"İstanbul Çekmeköy'deki hayvanat bahçesinde biyoenerji ve metafizik uzmanı olarak bilinen Salih Memişoğlu'nun da aralarında bulunduğu 2 kişiyi öldüren, 1 kişiyi de yaralayan Mustafa Ö. suçunu itiraf etti. Mustafa Ö., Salih Memişoğlu cinayetinin nedenini de açıkladı. Mustafa Ö., ""Salih Memişoğlu'ndan para istediğinde ""Benim Allah'tan başka kimseye borcum yok. Anlaştık ve sen paranı aldın."" cevabı üzerine sinirlendiğini ve tabancasını çıkararak rastgele ateş ettiğini söylediği öğrenildi.",12.3.2021
948,http://www.hurriyet.com.tr/gundem/izmirde-kadir-yukselin-cansiz-bedeni-evinde-bulunmustu-cinayetin-detaylari-ortaya-cikti-41760977,İzmir'de Kadir Yüksel'in cansız bedeni evinde bulunmuştu! Cinayetin detayları ortaya çıktı,"İzmir'in Bornova ilçesinde bir süredir kendisinden haber alınamayan 'Miraş Güneş' adını kullanan trans birey Kadir Yüksel'in cansız bedeni, apartmanda kötü kokuların yayılmasıyla evinde bulunmuştu. Kadir Yüksel'in, kendisine ait boş dairede başına sert cisimle vurularak öldürüldüğü ortaya çıktı. Polis, çevredeki kamera kayıtlarını incelemeye aldı.&nbsp;",12.3.2021
949,http://www.hurriyet.com.tr/gundem/cinayet-bilmecesi-41760892,Cinayet bilmecesi,"Cengiz Kılıç (35), 16 Ağustos 2019’da İstanbul Kağıthane’de Ayşe Gül (28) ve eşi Yaşar Gül’ün oturduğu evin merdivenlerinde tabanca ile vurularak öldürüldü. ",12.3.2021
950,http://www.hurriyet.com.tr/gundem/izmirde-bir-kisi-dairesinde-olu-bulundu-sorusturma-baslatildi-41760974,İzmir'de bir kişi dairesinde ölü bulundu... Soruşturma başlatıldı,"İzmir'in Bornova ilçesinde, cesedi dairesindeki çekyat içinde battaniyeye sarılı halde bulunan trans bireyin ölümüne ilişkin soruşturma başlatıldı.",12.3.2021
951,http://www.hurriyet.com.tr/gundem/hayvan-haklarini-savunmak-icin-vegan-olmak-gerekir-mi-41754068,Kürkle gelen tartışma: Hayvan haklarını savunmak için vegan olmak gerekir mi?,"Sosyal medyada son günlerin en fazla tartışılan konularından biri ünlü isimlerin kürkleri. Kürk giyenleri eleştirenlere bir de ""Ha kürk giymişsiniz ha et yemişsiniz..."" diyenler eklenince ortalık epey karıştı. Peki hayvan hakları savunuculuğu için yeterlilik koşulu nedir? Farklı fikirleri dinledik...",11.3.2021
952,http://www.hurriyet.com.tr/gundem/kagithanedeki-cinayet-davasi-bunu-tek-basina-yapacagina-inanmiyorum-41760447,Kağıthane'deki cinayet davası: 'Bunu tek başına yapacağına inanmıyorum',"Kağıthane'de sevgilisi olduğu belirtilen kişiyi öldüren kadının yargılandığı davada dinlenen tanık,  ""Ayşe'nin bunu tek başına yapacağına inanmıyorum"" dedi.",11.3.2021
953,http://www.hurriyet.com.tr/gundem/unlulerin-hocasi-salih-memisoglunu-olduren-zanli-yakalandi-41760174,Ünlülerin hocası Salih Memişoğlu'nu öldüren zanlı yakalandı,"İstanbul Çekmeköy'de, hayvanat bahçesinde, kamuoyunda bioenerji ve metafizik uzmanı olarak bilinen Salih Memişoğlu'nun da aralarında bulunduğu 2 kişiyi öldürdüğü ve 1 kişiyi yaraladığı iddia edilen şüpheli gözaltına alındı.",11.3.2021
954,http://www.hurriyet.com.tr/gundem/mervenur-polat-cinayetinde-flas-gelisme-5-kisi-tutuklandi-41759945,Mervenur Polat cinayetinde flaş gelişme! 5 kişi tutuklandı,"Antalya'da 4,5 aydır kayıp olarak aranan 20 yaşındaki Mervenur Polat'ın ölü bulunmasıyla ilgili gözaltına alınan 7 zanlıdan 5'i tutuklandı, 2'si serbest bırakıldı. Gazetecilerin yönelttiği ""Neden öldürdünüz?"" sorusuna şüphelilerden biri ""Sonra gel, anlatırım"" şeklinde yanıt verdi.",10.3.2021
955,http://www.hurriyet.com.tr/gundem/son-dakika-beylikduzunde-bir-kadinin-cansiz-bedeni-bulundu-41759701,Son dakika... Beylikdüzü'nde bir kadının cansız bedeni bulundu,"Beylikdüzü'nde bir kadın evde başından silahla vurularak öldürülmüş halde bulundu. Olay sırasında kadının evinde bulunan erkek arkadaşı gözaltına alınırken, olayın cinayet mi intihar mı olduğunun tespiti için soruşturma sürüyor.",10.3.2021
956,http://www.hurriyet.com.tr/gundem/kadinlardan-yan-odaya-gecmelerini-isteyip-ev-sahibini-tabancayla-yaraladilar-41759293,"Kadınlardan yan odaya geçmelerini isteyip, ev sahibini tabancayla yaraladılar","Samsun'da geldikleri evde kadınların yan odaya geçmesini isteyen 4 kişi, tartıştıkları ev sahibi Adnan K.'yi (29) tabancayla bacaklarından vurdu. Şüpheliler kaçarken, Adnan K. hastanede tedaviye alındı.",10.3.2021
957,http://www.hurriyet.com.tr/gundem/istanbul-adalet-sarayindaki-kozmik-depo-41759126,İstanbul Adalet Sarayı’ndaki ‘kozmik depo’,"Çağlayan’daki İstanbul Adalet Sarayı’nın ‘kozmik odası’&nbsp;olarak tanımlanan adli emanet depolarında, Türkiye’nin en önemli soruşturma ve davalarına ait yaklaşık 200 bin delil yoğun güvenlik önlemleri altında saklanıyor.",10.3.2021
958,http://www.hurriyet.com.tr/gundem/bari-sen-boyle-konusma-onu-da-oldurseydi-alnindan-operdim-41759177,Bari sen böyle konuşma! ‘Onu da öldürseydi alnından öperdim',"İstanbul'da öldürüldükten sonra parçalanarak 8 ayrı poşete konup, yol kenarına atılmış bir halde bulunan Süleyman Akbaba'nın ilişki yaşadığı komşu kadının kocası tarafından öldürüldüğü belirlenmişti. Tutuklanan Alparslan Aslan'a ağırlaştırılmış müebbet hapis, tutuklanan eşi Nubar Aslan'a ise 20 yıla kadar hapis cezası istendi. Öte yandan, maktulün eşi Birsen Akbaba sanık Alpaslan Aslan için “İlk önce öldürmeyi seçmeyecekti. Ya da madem Süleyman’ı öldürdü, karısını da öldürecekti. O zaman Alpaslan’ı alnından öperdim. Ben çok ceza almalarını istiyorum” dedi.",10.3.2021
959,http://www.hurriyet.com.tr/gundem/istanbul-konya-eskisehir-ucgeninde-kanli-cinayet-41759179,İstanbul-Konya-Eskişehir üçgeninde... Kanlı cinayet!,"Astsubay Kıdemli Başçavuş Ali Şentürk, İstanbul’dan Konya’ya giderek eşiyle ilişkisi olduğu iddiasıyla Hekim Bingöl’ü Eskişehir yolunda öldürdü. Tutuklanan Şentürk, “Amacım konuşmaktı” dedi.",10.3.2021
960,http://www.hurriyet.com.tr/gundem/8-mart-mesaj-krizi-suruyor-pes-pese-aciklamalar-41758891,8 Mart 'mesaj' krizi sürüyor... Peş peşe açıklamalar,İstanbul Büyükşehir Belediye Başkanı Ekrem İmamoğlu’nun 8 Mart mesajıyla ilgili olarak İYİ PARTİ ve CHP’den art arda açıklamalar geldi. Ayrıntıları CNN TÜRK Muhabiri Duygu Ayaz Bayram aktardı.,9.3.2021
961,http://www.hurriyet.com.tr/gundem/istanbul-adalet-sarayinin-emanet-depolari-goruntulendi-19-oda-icinde-200-bin-delil-41758664,İstanbul Adalet Sarayı'nın emanet depoları görüntülendi! 19 oda içinde 200 bin delil...,"İstanbul Şişli'deki İstanbul Adalet Sarayı'nın&nbsp; 'kozmik odası' emanet depolarında yoğun güvenlik önlemleri altında saklanan soruşturma delilleri DHA tarafından görüntülendi. Emanet depolarında saklanan deliller arasında FETÖ'nün örgüt üyelerine dağıttığı 1 dolarlar,&nbsp; 15 bin silah, bunların içinde 15 Temmuz darbe girişiminde ele geçirilenler, Reina saldırısında kullanılanlar,&nbsp; Adnan Oktar operasyonunda ele geçirilen keskin nişancı tüfeği, terör örgütü PKK'nın Kuzey Irak'ta kurmayı planladığı TV kanalı için gerekli malzemeler de var.",9.3.2021
962,http://www.hurriyet.com.tr/gundem/10-yasindaki-oglunu-bogarak-oldurmustu-cinayet-oncesi-ozur-dileyip-opmus-41758609,"10 yaşındaki oğlunu boğarak öldürmüştü! Cinayet öncesi özür dileyip, öpmüş","Konya'da, dün oğlu Hüseyin Kılınçer'i (10) elleriyle boğarak, öldüren apartman görevlisi&nbsp;İsmail Kılınçer'in (32) emniyetteki&nbsp;ifadesi ortaya çıktı. Cinayeti&nbsp;2 hafta önceden planladığını itiraf eden Kılınçer, ''Ben çok günah işledim ve cehenneme gideceğim. Oğlum da büyüdükçe günaha girecekti. Ben onu günaha girmeden cennete gönderdim. Oğlumu boğmadan önce ona kendisini öldüreceğimi söyleyip, özür diledikten sonra öptüm. O da 'Babacığım' diye sarılıp, 'Ben de senden özür dilerim' dedi ve sonra da boğarak öldürdüm’' dedi.&nbsp;",9.3.2021
963,http://www.hurriyet.com.tr/gundem/vahsetin-boylesi-gorulmedi-bogazini-kesip-uzerini-molozla-kapatti-41758574,Vahşetin böylesi görülmedi! Boğazını kesip üzerini molozla kapattı,"Konya’da, kendisinden haber alınamayan, Yunak Kaymakamlığı'nda görevli Hekim Bingöl’ün (49) cinayete kurban gittiği ortaya çıktı. Bingöl'ü boğazını&nbsp;keserek, öldürüp, üzerini molozla&nbsp;kapattığı belirlenen ve gözaltına alınan Jandarma Astsubay Kıdemli Başçavuş Ali Şentürk&nbsp;(42), Bingöl'ün eşiyle ilişkisi olduğunu, tartışma&nbsp;sırasında bıçakla saldırırken, boğazından yaralandığını öne sürdü. Şentürk, sevk edildiği adliyede çıkarıldığı mahkemece tutuklandı.&nbsp;",9.3.2021
964,http://www.hurriyet.com.tr/gundem/adanada-komsu-kavgasi-sirasinda-esinin-kazara-vurdugu-kadin-hayatini-kaybetti-41758552,Adana'da komşu kavgası sırasında eşinin kazara vurduğu kadın hayatını kaybetti,"Adana'da komşular arasında çıkan kavgada eşinin pompalı tüfekle kazara vurduğu kadın, hastanede yaşamını yitirdi.",9.3.2021
965,http://www.hurriyet.com.tr/gundem/bu-ne-vahset-merve-polat-cinayetinde-yeni-ayrintilar-41758329,Bu ne vahşet! Mervenur Polat cinayetinde yeni ayrıntılar...,"Yaklaşık 4.5 aydır kayıp olarak aranan Mervenur Polat’ın cansız bedeni bir binanın çatısında folyoya sarılı halde bulundu. Arkadaşı C.A.’nın, birlikte uyuşturucu aldığı Polat´ın öldüğünü görünce, cesedini folyoya sarıp motosikletli kurye arkadaşı aracılığıyla babasının oturduğu binanın asansör dairesine bıraktırdığı belirlendi.",9.3.2021
966,http://www.hurriyet.com.tr/gundem/kadinlar-gununde-mesaj-atti-ortalik-karisti-41758374,Kadınlar Günü'nde mesaj attı ortalık karıştı,İmamoğlu’nun “Akşener ve Buldan’ın nezdinde tüm kadın siyasetçilerin ve belediye başkanlarının Kadınlar Günü’nü kutladığı” mesajına İYİ Parti’den sert tepkiler geldi. İmamoğlu dün Buldan’la ağaç dikme etkinliğine katılırken tepkilere “Tümüyle iyi duygularla yazılmıştır” yanıtını verdi.,9.3.2021
967,http://www.hurriyet.com.tr/gundem/son-dakika-cumhurbaskani-erdogandan-onemli-aciklamalar-41757881,Son dakika... Samsun'daki vahşete tepki gösterdi... Cumhurbaşkanı Erdoğan yeni adımı açıkladı,"Cumhurbaşkanı ve AK Parti Genel Başkanı Recep Tayyip Erdoğan, AK Parti Kadın Kolları 6. Olağan Kongresi'ne katıldı. Erdoğan konuşmasında Samsun'da cadde ortasında dövülen kadının Türkiye'yi ayağa kaldıran görüntüleriyle ilgili konuştu. Vahşete tepki gösteren Cumhurbaşkanı Erdoğan, kadına şiddete karşı atacakları yeni adımı ''Şimdi Meclis'te yeni bir komisyon oluşturuyoruz.  Kadınların şiddete maruz bırakılmasına müsaade edemeyiz'' diyerek anlattı. ",8.3.2021
968,http://www.hurriyet.com.tr/gundem/imamoglunun-8-mart-mesaji-krize-neden-oldu-iyi-partililer-tepki-gosterdi-buldan-tesekkur-etti-41757835,"İmamoğlu'nun 8 Mart mesajı krize neden oldu! İYİ Partililer tepki gösterdi, Buldan teşekkür etti","İstanbul Büyükşehir Belediye Başkanı Ekrem İmamoğlu'nun 8 Mart mesajı krize neden oldu. Mesajında İYİ Parti Genel Başkanı Meral Akşener ve HDP Eş Genel Başkanı Pervin Buldan'ı etiketleyen İmamoğlu'na, İYİ Parti Genel Başkan Yardımcısı ve İstanbul Milletvekili Yavuz Ağıralioğlu ve AK Parti İstanbul İl Başkanı Osman Nuri Kabaktepe'den tepki geldi.",8.3.2021
969,http://www.hurriyet.com.tr/gundem/ceren-ozdemir-unutulmadi-oldurulen-kadinlar-dunya-kadinlar-gununde-aniliyor-41757547,Ceren Özdemir unutulmadı... Öldürülen kadınlar Dünya Kadınlar Günü'nde anılıyor,"Dünya Kadınlar Günü'nde eşleri, sevgililer veya hiç tanımadıkları erkekler tarafından öldürülen kadınlar da unutulmadı. Ordu'da bıçaklı saldırı sonucu katledilen Ceren Özdemir de 8 Mart’ın simgelerinden biri haline geldi. Sosyal medya kullanıcıları, Ceren Özdemir etiketiyle paylaşımda bulunuyor. ",8.3.2021
970,http://www.hurriyet.com.tr/gundem/icisleri-bakanligi-duyurdu-sorusturma-baslatildi-41757311,İçişleri Bakanlığı duyurdu! Soruşturma başlatıldı,"İçişleri Bakanlığı, Aydın'da dün evinde ölü bulunan 92 yaşındaki kadının katil zanlısının, adliyeye sevki sırasında elindeki dövmenin görülmesinde bir ihmal ya da kasıt bulunup bulunmadığının soruşturulması için 2 başmüfettiş görevlendirildiğini bildirdi.",7.3.2021
971,http://www.hurriyet.com.tr/gundem/son-dakika-haberi-devlet-bahceliden-kadina-siddet-tepkisi-tahammulumuz-yoktur-41757269,Son dakika haberi: Devlet Bahçeli'den kadına şiddet tepkisi: Tahammülümüz yoktur,"Milliyetçi Hareket Partisi lideri Devlet Bahçeli, '8 Mart Dünya Kadınlar Günü' için yayımladığı mesajında ""Kadın cinayetlerini, kadına şiddeti bütün kalbimle ve hissiyatımla lanetliyorum"" dedi.",7.3.2021
972,http://www.hurriyet.com.tr/gundem/tartistigi-esini-4-cocugunun-gozu-onunde-bicaklayarak-oldurdu-41757102,Tartıştığı eşini 4 çocuğunun gözü önünde bıçaklayarak öldürdü,"Ankara'da Zeynel Korkmaz (38), tartıştığı eşi Reyhan Korkmaz'ı 4 çocuğunun gözü önünde boğazından bıçaklayarak öldürdü. Olaydan sonra komşusunu arayarak ""Çocuklarım önce Allah'a sonra size emanet"" diyen Zeynel Korkmaz, polis ekiplerince gözaltına alındı.

",7.3.2021
973,http://www.hurriyet.com.tr/gundem/bir-cocuk-annesi-eski-es-kurbani-oldu-41756773,Eski eşini pompalı tüfekle vurarak öldürdü!,Türkiye'de kadın cinayetlerine bir yenisi daha eklendi. Denizli'de bir kişi tartıştığı eski eşini pompalı tüfekle vurarak öldürdü.,6.3.2021
974,http://www.hurriyet.com.tr/gundem/kayseride-kirmizi-ayakkabili-katil-sukru-efe-yakalandi-41756365,Kayseri'de 'kırmızı ayakkabılı katil' Şükrü Efe yakalandı!,"Kayseri'de boşandığı eski eşi Nuran Koçer'i (40) öldüren ve kırmızı ayakkabısı nedeniyle 'kırmızı ayakkabılı katil' olarak bilinen Şükrü Efe (42), Emniyet Müdürlüğü'ne 200 metre mesafede yakalandı. ",6.3.2021
975,http://www.hurriyet.com.tr/gundem/amasiz-fakatsiz-vahset-41756309,"‘Ama’sız, ‘fakat’sız vahşet","Feride Genç’i (37) boğarak öldürdükten sonra evi ateşe veren Muharrem Kabuk (48), ağırlaştırılmış müebbet hapis cezasına çarptırıldı. Sanığın, Feride Genç’i boğmak için kullandığı eşarbı silahtan sayan mahkeme, ‘konutta nitelikli yağma’ suçundan da 12 yıl hapis cezası verdi. Cezalara indirim uygulanmadı.",6.3.2021
976,http://www.hurriyet.com.tr/gundem/copu-atmadigi-icin-kardesini-11-yerinden-bicaklayarak-oldurdu-41756343,Çöpü atmadığı için kardeşini 11 yerinden bıçaklayarak öldürdü,"Ankara'nın Çankaya ilçesinde, üniversite öğrencisi M.K. (20), anne ve babasının evde olmadığı sırada çöpü atmadığı gerekçesiyle tartıştığı kardeşi K.K.'yı (16) 11 yerinden bıçaklayarak öldürdü. M.K. olay sonrası polisi arayarak teslim oldu.",6.3.2021
977,http://www.hurriyet.com.tr/gundem/hrant-dink-cinayeti-davasi-ertelendi-41755681,Hrant Dink cinayeti davası ertelendi,Tüm Türkiye'nin merakla beklediği Agos Gazetesi Genel Yayın Yönetmeni Hrant Dink'in öldürülmesine ilişkin duruşma 26 Mart tarihine ertelendi.,5.3.2021
978,http://www.hurriyet.com.tr/gundem/basaksehirden-cok-aci-haber-nebahat-kurt-evinin-onunde-olduruldu-41755551,Başakşehir'den çok acı haber! Nebahat Kurt evinin önünde öldürüldü,"İstanbul Başakşehir'de 1 çocuk annesi 46 yaşındaki Nebahat Kurt, evinin önünde başına silahla ateş edilerek öldürüldü. Acı haberi alan ailesi olay yerinde ağıtlar yakarken, polis Nebahat Kurt'u kocası emekli başçavuş Emrullah Kurt'un öldürdüğünü belirledi. Emrullah Kurt, polisleri fark edince babasının evinin önünde başına ateş ederek intihar etti.",5.3.2021
979,http://www.hurriyet.com.tr/gundem/evinin-onunde-katledildi-41755414,Evinin önünde katledildi,"Ardı arkası kesilmeyen kadın cinayetlerine dün akşam bir yenisi daha eklendi. Başakşehir’de 1 çocuk annesi Nebahat Kurt, başından vurularak öldürüldü. Polis kocasının peşinde. ",5.3.2021
980,http://www.hurriyet.com.tr/gundem/baskonsolos-cinayet-gunu-koruma-polisine-izin-vermis-41755319,Başkonsolos cinayet günü koruma polisine izin vermiş,"Kaşıkçı cinayeti davasında ifade veren dönemin Suudi Başkonsolosu Uteybi’nin koruma polisi, “Başkonsolos o gün bana izin vermişti” dedi.",5.3.2021
981,http://www.hurriyet.com.tr/gundem/hrant-dink-cinayeti-davasinda-karar-yarin-41755030,Hrant Dink cinayeti davasında karar yarın,"Agos Gazetesi Genel Yayın Yönetmeni Hrant Dink'in öldürülmesine ilişkin FETÖ elebaşı Fetullah Gülen, eski savcı Zekeriya Öz, gazeteciler, jandarma ve eski emniyet görevlilerinin de aralarında bulunduğu 6'sı tutuklu, 13'ü firari 76 sanığın yargılandığı davayla ilgili karar yarın açıklanacak.",4.3.2021
982,http://www.hurriyet.com.tr/gundem/agabeyi-ve-kardesini-oldurdu-baba-gozyaslarina-boguldu-yuregim-yaniyor-41754825,Ağabeyi ve kardeşini öldürdü! Baba gözyaşlarına boğuldu: 'Yüreğim yanıyor',"Denizli'nin Merkezefendi ilçesinde inşaat ustası Doğan A. (37), birlikte çalıştıkları ağabeyi ve kardeşini tabancayla vurarak öldürdü. Kaçan Doğan A. yakalanarak gözaltına alındı. Haberi alınca gözyaşlarına boğulan baba Kasım A., ""Böyle bir şey olamaz. Mümkün değil. Yüreğim yanıyor"" diyerek feryat etti.",4.3.2021
983,http://www.hurriyet.com.tr/gundem/ayni-gun-6-kisiyi-bicaklayan-saldirgandan-kan-donduran-ifade-jokere-benzemek-istedim-41754417,Aynı gün 6 kişiyi bıçaklayan saldırgandan kan donduran ifade: Joker’e benzemek istedim,"İSTANBUL Şişli’de 26 Şubat Cuma günü öğle saatlerinde, kar maskeli ve kamuflaj giyimli Afgan Ahmad Samir H., sokakta yürürken Nijerya uyruklu Solomon Anyadike’yi göğsünden ve bacağından ‘sustalı’ diye tabir edilen bıçakla yaraladı. Saldırgan olay yerinden hızlıca uzaklaşırken, yaralanan Solomon Anyadike hastaneye kaldırıldı.",4.3.2021
984,http://www.hurriyet.com.tr/gundem/sislide-dehset-sacti-ayni-gunde-6-kisiyi-bicakladi-ifadesi-saskina-cevirdi-41753988,"Şişli'de dehşet saçtı! Aynı günde 6 kişiyi bıçakladı, ifadesi şaşkına çevirdi","İstanbul Şişli'de “sustalı” diye tabir edilen bıçak ile aynı günde 6 kişiyi çeşitli yerlerinden yaralayan Afganistan uyruklu Ahmad Samir H. yakalandı. Şüphelinin ilk ifadesinde “Joker filmini çok seviyorum, maskemi ona benzetmek istedim” dediği öğrenildi. Zanlının bir kişiyi yaraladığı anlar da görüntülendi.",3.3.2021
985,http://www.hurriyet.com.tr/gundem/16-yildir-faili-mechuldu-sir-cinayet-aydinlandi-41753454,16 yıldır faili meçhuldü... Sır cinayet aydınlandı,"Trabzon Akçaabat’a bağlı Kuruçam köyünde yalnız yaşayan Fatime Balcı (73), 28 Mayıs 2005’te evine giren kimliği belirsiz kişinin kendisini 17 kez bıçaklaması üzerine hayatını kaybetmişti. Jandarma ekiplerince, o dönem yapılan çalışmada evde yapılan incelemede herhangi bir şeyin çalınmadığı anlaşılırken, faile de ulaşılamadı.",3.3.2021
986,http://www.hurriyet.com.tr/gundem/sir-perdesi-aralandi-16-yillik-cinayet-boyle-cozuldu-41753026,Sır perdesi aralandı! 16 yıllık cinayet böyle çözüldü,"Trabzon’un Akçaabat ilçesinde Fatime Balcı’nın (73), 16 yıl önce yalnız yaşadığı evinde 17 yerinden bıçaklanarak öldürüldüğü faili meçhul cinayet, jandarma ekiplerinin yürüttüğü titiz çalışmaların yanı sıra gelişen teknolojik ortamda yapılan kan ve parmak izi eşlemesiyle çözüldü. Kan örneklerinin uyuştuğu ve cinayeti işlediği ortaya çıkması sonucu gözaltına alınan şüpheli H.B. (34), adliyeye sevk edildi.",2.3.2021
