,url,title,abstract,date
277,http://www.hurriyet.com.tr/gundem/amcasinin-oglunu-av-tufegiyle-vurarak-oldurdu-29477994,Amcasının oğlunu av tüfeğiyle vurarak öldürdü,"OSMANİYE’nin Toprakkale İlçesi’nde 52 yaşındaki Mehmet Öksüz, tarla meselesi yüzünden tartıştığı amcasının oğlu 35 yaşındaki Ahmet Öksüz’ü av tüfeğiyle başından vurarak öldürdü.",6.7.2015
278,http://www.hurriyet.com.tr/gundem/csi-kayseri-29461658,CSI Kayseri,"Kayseri’de kurulan özel ekip sayesinde son 17 yılda faili meçhul kalan 6 cinayet, CSI filmlerine konu olacak şekilde çözüldü. Yıllar sonra polisi karşılarında görünce şaşıran katillerden birinin, “Ben bile cinayeti unutmuştum, nereden çıktınız” dediği öğrenildi.",5.7.2015
279,http://www.hurriyet.com.tr/gundem/diyarbakir-da-namus-cinayeti-2-olu-29440108,Diyarbakır’da namus cinayeti: 2 ölü,"DİYARBAKIR’da 31 yaşındaki Ömer Çetin, ayrı yaşadığı eşiyle ilişkisi olduğu iddiasıyla 37 yaşındaki Mehmet Uludağ ile yanında bulunan 35 yaşındaki Recep Dengiz’i tabanca ile ateş ederek öldürdü. Çetin, daha sonra silahıyla birlikte polise giderek teslim oldu.",2.7.2015
280,http://www.hurriyet.com.tr/gundem/dort-gunluk-bebegini-emzirip-cope-atmis-29430960,Dört günlük bebeğini emzirip çöpe atmış,"Konya’da, dört günlük bir kız bebeğin şehir çöplüğünde ölü bulunmasının ardından yapılan araştırmada, anne bulundu. Annenin  gayrimeşru bebeğini hastanede doğurduktan sonra bir parkta emzirip daha sonra canlı canlı çöpe attığı ortaya çıktı.",1.7.2015
281,http://www.hurriyet.com.tr/gundem/mhp-lideri-devlet-bahceliden-onemli-aciklamalar-29428989,MHP lideri Devlet Bahçeli'den önemli açıklamalar,"MHP Genel Başkanı Devlet Bahçeli partisinin grup toplantısında konuştu. Bahçeli, Kemal kılıçdaroğlu'nun koalisyon çağrısı ve ""Gel başbakan sen ol"" teklifini sert sözlerle eleştirerek, ""Sayın Kılıçdaroğlu, şahsıma başbakanlık teklifinde bile bulunmuş, bizi HDP ile yan yana koymuştur. Merakımdan soruyorum Kılıçdaroğlu? Başbakanlık makamına şahsıma lütfetme yetkisini kimden ve nasıl almıştır? Bu ne pişkinliktir"" dedi.",1.7.2015
282,http://www.hurriyet.com.tr/gundem/uc-el-olum-29426241,Üç el ölüm,"DENİZLİ’nin Kale ilçesinde görevli İtfaiye Eri, Mehmet Ali Talay (39), önceki gece eşinin arkadaşı zabıta görevlisi Nesrin Zıraplı (24) ile otomobilde tartışmaya başladı. Zabıta Zıraplı, ruhsatsız tabancayla Talay’ı 3 el ateş ederek öldürdü. Daha sonra Kale Belediye Başkanı Erkan Hayla’yı arayarak cinayet işlediğini söyledi. Genç kadın gözaltına alındı.",30.6.2015
283,http://www.hurriyet.com.tr/gundem/tufekle-kopek-oldurene-1002-lira-ceza-29419762,Tüfekle köpek öldürene 1002 lira ceza,"EDİRNE’de inşaat şantiyesindeki bekçi köpeğine av tüfeğiyle 5 el ateş ederek öldüren 41 yaşındaki Yüksel Kuanç’a hayvan koruma kanunu gereğinde 1002 lira idari para cezası kesildi. Edirne Hayvanları, Doğayı Koruma ve Yaşatma Derneği üyeleri ise eylem yaparak Kuanç’ın tutuklanması gerektiğini savundu.",30.6.2015
284,http://www.hurriyet.com.tr/gundem/kadin-zabita-itfaiye-erini-tabancayla-oldurdu-29419275,"Kadın zabıta, itfaiye erini tabancayla öldürdü","DENİZLİ’nin Kale Belediyesi’nde görevli zabıta memuru 24 yaşındaki Nesrin Z, otomobilde bilinmeyen bir nedenle tartıştığı itfaiye eri 39 yaşındaki Mehmet A. T'yi tabancayla öldürdü. Genç kadın daha sonra belidiye başkanını arayarak cinayet işlediğini söyledi.",30.6.2015
285,http://www.hurriyet.com.tr/gundem/komiser-cevde-ajanlik-yapti-29406421,Komiser ÇEV'de ajanlık yaptı,"Ergenekon davasında hakkındaki yakalama kararı kaldırılan ve 11 Eylül’de ABD’den telekonferans ile ifadesi alınacak olan Çağdaş Eğitim Vakfı (ÇEV) Onursal Başkanı Gülseven Yaşer, Ramazan Akyürek’in İstanbul Emniyet Müdür Yardımcısı olduğu dönemde bir komiserin ÇEV’de ajanlık yaptığını söyledi.",29.6.2015
286,http://www.hurriyet.com.tr/gundem/bosandigi-esini-tabancayla-basindan-vurup-oldurdu-29406273,Boşandığı eşini tabancayla başından vurup öldürdü,"Adıyaman’ın Besni İlçesi’nde 43 yaşındaki Şahin B., 6 ay önce boşandığı 41 yaşındaki Sevgi Pektaş’ı tabancayla başından vurup öldürdükten sonra polise teslim oldu.",28.6.2015
287,http://www.hurriyet.com.tr/gundem/fethiye-deki-faili-mechul-cinayetlerin-sirri-cozuldu-29397750,Fethiye’deki faili meçhul cinayetlerin sırrı çözüldü,"MUĞLA’nın Fethiye İlçesi’nde 2011 yılında iki kamyoncu ve bir çobanı öldürdüğü gerekçesiyle 3 kez ömürboyu hapis cezası alan 38 yaşındaki Salim Olaş'ın, 2 kişinin daha katil zanlısı olduğu ortaya çıktı. 

 2009 yılında akaryakıt istasyonu görevlisi 30 yaşındaki Asım Dağlı ile aynı yaştaki Mustafa Kökçü’yü de öldürdüğü ortaya çıktı.",27.6.2015
288,http://www.hurriyet.com.tr/gundem/cinayetin-zanlisi-3-yil-sonra-yakalandi-29393014,Cinayetin zanlısı 3 yıl sonra yakalandı,Kayseri'de 3 yıl önce işlenen cinayetin zanlısı olduğu iddia edilen kişi tutuklandı.,26.6.2015
289,http://www.hurriyet.com.tr/gundem/onur-ozbizerdik-serbest-kaldi-29388568,Onur Özbizerdik serbest kaldı,"Yeraltı dünyasının ünlü kabadayısı Dündar Kılıç'ın torunu, Alaattin Çakıcı'nın üvey oğlu Onur Özbizerdik, adliyeye getirildikten saatler sonra serbest bırakıldı. Şubeye getirilişinde basın mensuplarının 'Neden vurdunuz?' sorusuna sinirlenen Onur Özbizerdik, adliyeye gidişinde de benzer bir soruya soğukkanlı bir şekilde 'Kuzey ırak'ta bin 500 kişiyi vurdum' cevabını verdi. Onur Özbizerdik saat 15.50 itibariyle serbest bırakıldı.",26.6.2015
290,http://www.hurriyet.com.tr/gundem/isim-benzerligi-nedeniyle-yalnis-mahkum-saliverildi-iddiasi-29381833,İsim benzerliği nedeniyle yalnış mahkum salıverildi iddiası,ÇANAKKALE E Tipi Cezaevi’nden tahliyesine 1.5 ay kalan ve rahatsızlandığı için tedavisi için 6 ay özel izin verilen 55 yaşındaki Mustafa Sezer’in yerine isim benzerliği nedeniyle cinayet suçundan yatan 22 yaşındaki başka bir hükümlünün salıverildiği ileri sürüldü.,25.6.2015
291,http://www.hurriyet.com.tr/gundem/bebegini-doverek-oldurdugu-iddiasiyla-sevgilisi-ile-gozaltina-alindi-29380174,Bebeğini döverek öldürdüğü iddiasıyla sevgilisi ile gözaltına alındı,"KAYSERİ’de dün 112 Acil Sağlık ekibinin ihbar üzerine gittiği evde baygın halde bulup hastaneye kaldırdığı 2 yaşındaki Adem Avşar yaşamını yitirdi. Polis, çocuğun annesi 24 yaşındaki M.A. ile sevgilisi 27 yaşındaki K.D.’yı işkenceyle ölüme neden oldukları iddiasıyla gözaltına aldı.",25.6.2015
292,http://www.hurriyet.com.tr/gundem/teror-operasyonundan-cinayet-itirafi-cikti-29378923,Terör operasyonundan cinayet itirafı çıktı,"Terörle Mücadele Şubesi Müdürlüğü ekiplerinin geçtiğimiz günlerde PKK'nın gençlik yapılanması YDG-H örgütüne yönelik düzenlediği operasyonda gözaltına alınan 4 şüpheli adliyeye sevk edildi. Gözaltına alınan bir şüpheli, 2014 yılında işlediği cinayeti emniyette itiraf etti.",25.6.2015
293,http://www.hurriyet.com.tr/gundem/kizinin-katil-zanlisi-ikinci-durusmada-tahliye-edilen-anne-isyan-etti-29375562,Kızının katil zanlısı ikinci duruşmada tahliye edilen anne isyan etti,"Bursa'da 8 Mart Dünya Kadınlar Günü'nde kıskançlık yüzünden tartıştığı 17 yaşındaki kız arkadaşını tabancayla vurarak öldürdüğü iddia edilen 23 yaşındaki sanık ikinci duruşmada tahliye edildi. Savcı ilk duruşmasındaki tahliye talebini tekrarlayınca kısa bir ara veren mahkeme heyeti, ‘suç vasfının değişme ihtimalinin bulunması, tutuklu kaldığı süre ve delilerin toplandığı’ gerekçesiyle sanığın adli kontrol şartıyla tahliye edilmesine hükmetti. Mahkeme çıkışı kendini yere atan öldürülen kızın annesi, ""Daha üç ay oldu, kızım daha toprağın altında çürümedi.  Devlet bu mu, adalet bu mu?"" diyerek isyan etti. Duruşmada konuşan sanığın, ""Abla, sen kızını ben de canımı kaybettim"" şeklindeki beyanına karşı kızın annesinin, ""Ben de 9 ay karnımda taşıdığım çocuğumu kaybettim"" demesi damga vurdu.",25.6.2015
294,http://www.hurriyet.com.tr/gundem/silifke-kooperatifi-ve-silifke-belediye-spor-kulubu-baskani-unal-unuvar-olu-bulundu-29375351,Silifke Kooperatifi ve Silifke Belediye Spor Kulübü Başkanı Ünal Ünüvar ölü bulundu,"MERSİN’in Silifke İlçesi’nde dün öğle saatlerinden itibaren haber alınamayan Silifke Kooperatifi ve Silifke Belediye Spor Kulübü Başkanı Ünal Ünüvar ölü bulundu. Olayla ilgili soruşturma sürerken, 2 gün önce ölüm tehdidi aldığı için savcılığa suç duyurusunda bulunan Ünüvar'ın, tehdit içerikli mesajlarının bulunduğu cep telefonu da incelemeye alındı.",25.6.2015
295,http://www.hurriyet.com.tr/gundem/kayip-unuvar-in-cesedi-bulundu-29372530,Kayıp Ünüvar’ın cesedi bulundu,MERSİN’in Silifke İlçesi’nde bugün öğle saatlerinden itibaren haber alınamayan Silifke Kooperatifi ve Silifke Belediye Spor Kulübü Başkanı Ünal Ünüvar’ın cesedi bulundu.,24.6.2015
296,http://www.hurriyet.com.tr/gundem/polis-suclu-yakalama-rekoru-kirdi-29365732,Polis suçlu yakalama rekoru kırdı,"Asayiş Şube Müdürlüğü istatistiklerine göre 2015 yılının ilk 5 ayında cinayet, gasp, hırsızlık gibi olaylardan 15 bin 500 kişi gözaltına alındı. Polisin suçlu yakalama oranı 2013 yılına göre yüzde 140, 2014 yılına göre ise yüzde 70 artış göstererek rekor kırdı.  İstatistiklere göre İstanbul'da yaşanan suç olaylarında ise toplamda yüzde 13'lük bir düşüş yaşandığı belirtildi.",24.6.2015
297,http://www.hurriyet.com.tr/gundem/esenyurt-cinayetinde-flas-gelisme-29360615,Esenyurt cinayetinde flaş gelişme,Esenyurt'ta 5 ay önce iki ayrı araçtan açılan çapraz ateş sonucu hayatını kaybeden Melik Özbaş (37) cinayetiyle ilgili 13 kişi gözaltına alındı. Olayın 2013 yılında Erzurum'da iki aile arasında gerçekleşen kaleşnikofların da kullanıldığı kavganın devamı olduğu öğrenildi.,23.6.2015
298,http://www.hurriyet.com.tr/gundem/korkunc-gercek-sorguda-ortaya-cikti-29339687,Korkunç gerçek sorguda ortaya çıktı,"Bursa'da 15 ve 17 yaşındaki iki genç, amcalarının 2 sene önceki ölümünden sorumlu tuttukları 32 yaşındaki inşaat işçisini sokak ortasında çapraz ateşe tutup öldürdü. Terminalde yakalanan zanlılar verdikleri ifadede kendileriyle birlikte gelen 2 akrabasının da başka bir şahsı öldüreceğini söyledi. Bunun üzerine harekete geçen polis, pusuda bekleyen 2 şahsı gözaltına aldı.",20.6.2015
299,http://www.hurriyet.com.tr/gundem/mit-mensuplari-ask-cinayeti-kurbaniymis-29335697,MİT mensupları aşk cinayeti kurbanıymış,"İstanbul Güneşli’de iki MİT mensubunun ölü bulunması, güvenlik birimlerini alarma geçirdi. Yapılan araştırma sonunda, O.S.’nin bir süredir ilişki yaşadığı, kendisi gibi MİT mensubu olan E.Y.’yi ensesinden vurarak öldürdükten sonra yaşamına son verdiği ortaya çıktı.",20.6.2015
300,http://www.hurriyet.com.tr/gundem/mahkemede-verdigi-ifade-ile-soke-etti-29333120,Mahkemede verdiği ifade ile şoke etti,"Antalya'da 2 yıldır birlikte yaşadığı 21 yaşındaki Deniz Aktaş’ı 4 Mart sabahı tabancayla öldüren 40 yaşındaki Lokman Barış Çelik, verdiği ifadeyle şaşırttı. Çelik, Deniz Aktaş'ın 'Hadi bana yumurta kır' sözüne sinirlenindiğini ve sonrasında da erkekliğine laf ettiğini söyledi.",19.6.2015
301,http://www.hurriyet.com.tr/gundem/meb-calisani-ayse-atasayar-rezidansta-olu-bulundu-29334376,"MEB çalışanı Ayşe Atasayar, rezidansta ölü bulundu","MEB çalışanı Ayşe Atasayar, Ankara’da bir rezidansta ölü bulundu. Olayla ilgili, ‘FATİH’ projesi yolsuzluğu iddialarında adı geçen, evin sahibi ve Atasayar’ın sevgilisi Murat Akar, ‘cinayet’ şüphesiyle tutuklandı.",19.6.2015
302,http://www.hurriyet.com.tr/gundem/ormanda-sevgili-vahseti-29334074,Ormanda sevgili vahşeti,"Rukiye T., yeni sevgilisinden eski sevgilisindeki eşyasını almasını isteyince korkunç bir cinayet işlendi. Yeni sevgili ve arkadaşları, eski sevgiliyi döve döve öldürdü.",19.6.2015
303,http://www.hurriyet.com.tr/gundem/sabah-tehdit-aldigini-soyledi-aksam-olduruldu-29334154,Sabah tehdit aldığını söyledi akşam öldürüldü,"Adana’da tehdit aldığı için polise başvuruda bulunan bir kişi, gittiği restoranda arkasından gelen iki kişi tarafından bıçaklanarak öldürüldü.",19.6.2015
304,http://www.hurriyet.com.tr/gundem/cansu-kayanin-katil-zanlisi-arama-calismalarina-katilmis-29329271,Cansu Kaya'nın katil zanlısı arama çalışmalarına katılmış,"Muğla'nın Ortaca İlçesi'nde sulama kanalında ölü bulunan Cansu Kaya'ya tecavüz ettikten sonra genç kızı boğarak öldüren zanlılardan birinin, dikkat dağıtmak için kanalda arama çalışmalarına katıldığı belirlendi.",19.6.2015
305,http://www.hurriyet.com.tr/gundem/cansu-kayanin-katil-zanlilari-ifade-verdi-m-p-c-suya-atladi-arkasindan-da-cansu-suya-atladi-cansu-sudan-cikmayinca-29322514,"Cansu Kaya'nın katil zanlıları ifade verdi: 'M.P.C., suya atladı, arkasından da Cansu suya atladı. Cansu sudan çıkmayınca...'","Muğla’nın Ortaca İlçesi’nde, 18 yaşındaki Cansu Kaya’nın kanalda ölü bulunmasının ardından başlatılan soruşturmada, Kaya'nın iki arkadaşı gözaltına alındı. Şüphelilerin olay günü Kaya ile geç saatlerde göle girdikleri iddia edildi.",19.6.2015
306,http://www.hurriyet.com.tr/gundem/bu-kez-cansu-yla-canimiz-yandi-29324962,Bu kez Cansu’yla canımız yandı,"Muğla Ortaca'da cesedi bulunan Cansu Kaya'nın cinsel saldırı sonrası öldürüldüğü tespit edildi. Gaziantep'te Arzu Köse, Bursa'da ise Sevda Uysal ile annesi Ayşe Şahin öldürüldü. Kadınlar bugün, 'Özgecan yasası artık çıksın' diye yürüyecek.",18.6.2015
307,http://www.hurriyet.com.tr/gundem/polis-dehseti-2-kadini-oldurdu-29322135,Polis dehşeti: 2 kadını öldürdü,"Bursa’da, polis memuru 41 yaşındaki Abbas Usta, sevgilisi 42 yaşındaki Sevda Uysal ile annesi 75 yaşındaki Ayşe Şahin’i tabanca ile öldürdü. Cinayet sonrası Usta, silahıyla teslim oldu.",18.6.2015
308,http://www.hurriyet.com.tr/gundem/esini-oldurdu-intihar-susu-verdi-onu-cok-seviyordum-yanlislikla-vurdum-29317831,"Eşini öldürdü, intihar süsü verdi: “Onu çok seviyordum, yanlışlıkla vurdum”","GÜVENLİK görevlisi Songül A. (39) alnının ortasında isabet eden tek kurşunla öldü. Koca Hakan A. (37), polisi arayarak eşinin intihar ettiğini bildirdi. Olay yerinde inceleme yapan cinayet dedektifleri, cesedin yatış şekli, silahının bulunduğu mesafe, kurşunun alnının ortasından girişi gözönüne alarak soruşturmayı derinleştirdi. Hakan A. çapraz sorguda eşini ruhsatsız silahla öldürdüğünü kabul etti, “Onu çok seviyordum, silah nasıl ateş aldı, nasıl oldu bilmiyorum” itirafında bulundu.",18.6.2015
309,http://www.hurriyet.com.tr/gundem/eskisehirdeki-cinayet-ve-yaralama-davasi-29297954,Eskişehir'deki cinayet ve yaralama davası,"Eskişehir'de, eşi, kayınbiraderi ve teyzesinin oğlunu öldürdüğü, kayınvalidesini de yaraladığı iddiasıyla tutuklanan sanığın yargılanmasına devam edildi.",16.6.2015
310,http://www.hurriyet.com.tr/gundem/analiz-diye-mezari-kazilmis-29278455,Analiz diye mezarı kazılmış,2013’te ölen Hasan Ataş’ın katili Mustafa Bayram’ın kanlı bir plana kurban gittiği ortaya çıktı. Şüpheli Şerefettin Ataşoğlu’nun cinayet öncesi “Toprak analizi yaptıracağım” diyerek 2 ameleye 1 metre mezar çukuru kazdırdığı belirlendi.,13.6.2015
311,http://www.hurriyet.com.tr/gundem/cek-senet-baskini-29272304,Çek senet baskını,İstanbul’da paravan şirketler adına kestikleri çeklerle yaklaşık 150 milyon liralık vurgun yapan çeteye operasyon düzenlendi. 42 kişi gözaltına alındı.,12.6.2015
312,http://www.hurriyet.com.tr/gundem/parti-meclisinden-15-maddelik-bildirge-29259007,Parti Meclisi'nden 15 maddelik bildirge,"Halkalrın Demokratik Partisi,  bugün yapılan Parti Meclisi toplantısı 15 maddelik bir sonuç  bildirgesi açıkladı.  Seçim sonuçlarının değerlendirildiği Parti Meclisi Sonuç Bildirgesi'nde "" Meclis ve yeni kurulacak hükümet Türkiye'nin çok kimlikli, çok kültürlü, çok dilli, çok inançlı sosyal yapısını eksen alan, emeğin haklarının teminatı olan demokratik, özgürlükçü, eşitlikçi, sosyal ve ekolojik bir anayasa için çalışmaları hızla başlatmalı ve sonuçlandırmalıdır"" ifadelerine yer verildi.",11.6.2015
313,http://www.hurriyet.com.tr/gundem/mhpli-semih-yalcin-demirtasa-onun-saplari-bile-dusmez-29258223,MHP'li Semih Yalçın: Demirtaş'a onun sapları bile düşmez,"MHP Genel Başkan Yardımcısı ve İstanbul Milletvekili E. Semih Yalçın, HDP Eş Genel Başkanı Selahattin Demirtaş'ın MHP ile ilgili sözleri hakkında yazılı bir açıklama yaptı.  Yalçın, ""Bilinmelidir ki MHP yılanla aynı torbaya girmez. Bunların ellerinde askerimizin, polisimizin, sivil vatandaşlarımızın, en çok da Kürt kökenli vatandaşlarımızın kanı vardır. Zulümle, baskıyla cinayetle, terörle doğu ve güneydoğuyu boğan, kundaktaki bebeklere kurşun sıkacak kadar canavarlaşan bir örgütün siyasi kanadının şereften söz etmesi gülünçtür. Siyaset bir tarla, şeref de burada yetişen bir sebze olsa Demirtaş'a onun sapları bile düşmez"" dedi.",11.6.2015
314,http://www.hurriyet.com.tr/gundem/gunun-kan-donduran-haberi-once-oldu-sanip-bagaja-koyduk-ama-canli-oldugunu-ogrenince-29245466,Günün kan donduran haberi: Önce öldü sanıp bagaja koyduk ama canlı olduğunu öğrenince...,"İzmir’de, parası gasp edilip Kütahya’da öldürülen taksici Mustafa Güngör cinayeti ile ilgili iki zanlının hakim karşısında verdiği ifadeler kan dondurdu. Zanlılar, hakim karşısında birbirlerini suçlarken, taksi şoförünü Bornova’da öldürdüklerini sanıp bagaja koyup Kütahya’ya götürdüklerini fakat orada canlı olduğunu öğrendiklerini söyledi. İki zanlı, taksiciye önce sigara verdiklerini, daha sonra odunla darp edip boğazına ayakla basarak, kemerle boğup öldürdüklerini soğukkanlı bir şekilde anlattılar.",10.6.2015
315,http://www.hurriyet.com.tr/gundem/kaynanaya-pompali-vahset-29226199,Kaynanaya pompalı vahşet,"BOLU’nun Dörtdivan ilçesinde Erkan Güldemir'i (37) terk eden eşi, 1.5 ay önce Cemaller köyünde oturan annesi Nafiye Öztürk'ün (55) evine döndü.",8.6.2015
316,http://www.hurriyet.com.tr/gundem/balmumcu-da-derin-pusu-29226155,Balmumcu’da derin pusu,"1970’li yıllarda çok önemli birçok operasyonu yöneten, adı Susurluk ve Abdi İpekçi cinayetlerine de karışan emekli Albay Fehmi Altınbilek ve karısı, Balmumcu’da saldırıya uğradı. Adı değiştirilen albaya seçmen listesinden ulaşıp izleyen iki kişinin, koruma olmadığını anlayınca saldırıyı gerçekleştirdiği saptandı.",8.6.2015
317,http://www.hurriyet.com.tr/gundem/giresunda-cinayet-29213509,Giresun'da cinayet,"Giresun'un Espiye ilçesinde tartıştığı kişiyi öldürdüğü iddia edilen doktor, gözaltına alındı.",6.6.2015
318,http://www.hurriyet.com.tr/gundem/diyarbakirda-tencere-tavali-eylem-29208494,Diyarbakır'da tencere-tavalı eylem,Diyarbakır'da HDP'nin mitinginde meydana gelen patlamanın ardından vatandaşlar tencere-tavalı eylem yapmaya başladı. Bazı vatandaşlar ise ev ve iş yerlerinin ışıklarını kaparak saldırıya tepki gösteriyor.,5.6.2015
319,http://www.hurriyet.com.tr/gundem/basbakan-yardimcisi-arinc-hukuk-disinda-hicbir-ise-hukumetimiz-izin-vermez-29184578,Başbakan Yardımcısı Arınç: Hukuk dışında hiçbir işe hükümetimiz izin vermez,"Başbakan Yardımcısı Bülent Arınç, bazı medya kuruluşlarına el konulacağı ve gazetecilerin de aralarında bulunduğu 200 kişinin tutuklanacağı iddialarına ilişkin, ""Bu konu üzerine spekülasyon yapmak, Fuat Avnilerin işi. Kimse bu spekülasyonlara kanmasın, bunun üzerinden seçime yönelik herhangi bir yoruma, tedirginliğe yol açmasın. Hukuk dışında hiçbir işe hükumetimiz izin vermez. Yargının da buna alet olacağını sanmıyorum"" dedi.",3.6.2015
320,http://www.hurriyet.com.tr/gundem/manisada-cinayet-29176864,Manisa'da cinayet,"Manisa'nın Saruhanlı ilçesinde bir kişi, tartıştığı yengesini bıçaklayarak öldürdü.",2.6.2015
321,http://www.hurriyet.com.tr/gundem/antalyada-kiskanclik-cinayeti-29176013,Antalya'da kıskançlık cinayeti,"ANTALYA’da kıskançlık krizine giren Suriyeli 22 yaşındaki İsmail İbrahim, 18 yaşındaki eşi Ole Mahmut’u 5 yerinden bıçaklayarak öldürdü. Cinayetin ardından kaçan İbrahim, polis tarafından yakalanarak gözaltına alındı.",2.6.2015
322,http://www.hurriyet.com.tr/gundem/pes-pese-olen-3-kardesin-ilk-otopsi-sonucu-geldi-29171480,Peş peşe ölen 3 kardeşin ilk otopsi sonucu geldi,"Kars'ta 4 ay içinde peş peşe hayatını kaybeden üç kardeşin ölüm nedeni gizemini koruyor. 7 Nisan'da hayatını kaybeden 5 yaşındaki Enes'e yapılan otopside akciğer enfeksiyonu görüldü. Fakat baba Hacı Güler, 'Akciğer enfeksiyonundan öldüğüne inanmıyorum' dedi. Ailenin soy ağacı çıkarılacak.",2.6.2015
323,http://www.hurriyet.com.tr/gundem/acili-aile-otopsi-raporuna-guvenmiyor-29169098,Acılı aile otopsi raporuna güvenmiyor,"Kars'ın Arpaçay ilçesine bağlı Tomarlı köyünde peş peşe üç evladını kaybeden Güler ailesinin çocuklarından Enes'in otopsisinde ""akciğer enfeksiyonu"" görüldüğü belirtildi. Baba Güler otopsi sonucu için ""Akciğer enfeksiyonundan bir çocuğun kaybedileceğine inanmıyorum."" diye konuştu.",1.6.2015
324,http://www.hurriyet.com.tr/gundem/bodrumda-cinayet-29160495,Bodrum'da cinayet,"Muğla'nın Bodrum ilçesinde bir kişi, tartıştığı eski kız arkadaşını silahla başından vurdu, ardından intihar etti",1.6.2015
325,http://www.hurriyet.com.tr/gundem/devlet-babaya-ayse-tazminati-29159722,Devlet babaya 'Ayşe' tazminatı,"İstanbul Küçükçekmece’de kocasının sokak ortasında öldürdüğü Ayşe İnce’yle ilgili davaya bakan İdare Mahkemesi, ‘Kişilerin can ve mal güvenliğini devlet sağlamak zorunda’ gerekçesiyle, İçişleri Bakanlığı’nı 360 bin TL tazminata mahkûm etti.",31.5.2015
326,http://www.hurriyet.com.tr/gundem/25-kurus-icin-arkadasini-oldurdu-cesedini-yakti-29155449,25 kuruş için arkadaşını öldürdü cesedini yaktı,"Adana'da bir kişi, tanesi 25 kuruş olan kola şişesini kırdığı için kendisine küfreden arkadaşını boğarak öldürdü, 3 gün sonra cesedini yaktı. Zanlının bir televizyon programına telefonla bağlanarak, cinayetle ilgili soruları yanıtladığı ortaya çıktı. Cinayet, aynı programı arayan bir vatandaşın söylediklerinden sonra çözüldü.",31.5.2015
327,http://www.hurriyet.com.tr/gundem/bahceliden-cok-sert-sozler-29151335,Bahçeli'den çok sert sözler,"BAYBURT' ta konuşan MHP Genel Başkanı Devlet Bahçeli, Cumhurbaşkanı Recep Tayyip Erdoğan'ın MİT TIR'larının Adana'da durdurulmasını aylarca 'ihanet' olarak nitelendirdiğini hatırlattı, “Şimdi tüm gerçekler fotoğraflı bir şekilde ortaya çıkmıştır. MİT TIR'larının içinde bir şehri tümden havaya uçuracak silah ve mühimmat olduğu açıklığa kavuşmuştur” dedi.",30.5.2015
328,http://www.hurriyet.com.tr/gundem/hrant-dink-cinayeti-sorusturmasinda-yeni-detaylar-29138329,Hrant Dink cinayeti soruşturmasında yeni detaylar,"Emniyet Genel Müdürlüğü İstihbarat Daire Başkanlığı C Şube Müdürü Ali Fuat Yılmazer'in, Hrant Dink cinayeti kapsamında tutuklanmasına ilişkin kararda, yeni detaylar yer aldı. Kararda, Yılmazer tarafından İçişleri Bakanlığı'nın oluru ile oluşturulan ve sadece komiser ve yardımcılarının görev yaptığı 'C-5' isimli gizli birimin, Hrant Dink, Rahip Santoro ve Zirve Yayınevi cinayetleri ile Ergenekon, Balyoz gibi önemli olaylara baktığı belirtildi.",29.5.2015
329,http://www.hurriyet.com.tr/gundem/3-koca-3-vahset-29126543,3 koca 3 vahşet,"Ardı arkası kesilmeyen kadın cinayetlerine dün yenileri eklendi... İzmit’e 19 yaşındaki Neslihan Gönültaş, Elazığ’da ise 63 yaşındaki Güler Yıldırım eşleri, Muğla’da ise Ayfer Gökmen, barıştığı eski kocası tarafından öldürüldü.",27.5.2015
330,http://www.hurriyet.com.tr/gundem/kucaginda-1-5-aylik-kizi-varken-sakagindan-vurdular-29110776,"Kucağında 1,5 aylık kızı varken şakağından vurdular","Beşiktaş U14 Takımı'nın yıldız oyuncularından İlkay İşler'in babası Kamil İşler, evinin önünde kucağında 1.5 aylık kızı olduğu halde şakağına isabet eden bir kurşunla vurularak, öldürüldü. Eşi Derya İşler, kurşunun Galatasaray'ın şampiyonluk sevincini kutlayan bir taraftarın silahından çıktığını iddia ederken polis, Kamil İşler'in katil zanlısının daha önceden aralarında husumet bulunan bir kişi olduğunu belirledi. İşler'e pusu kuran katil zanlısı aranıyor.",26.5.2015
331,http://www.hurriyet.com.tr/gundem/sedef-kabas-beraat-etti-29107936,Sedef Kabaş beraat etti,"""Tweet soruşturması"" kapsamında evine arama yapmaya gelen polislere ""direnme"" ve ""hakaret"" suçlarını işlediği iddia ediliyordu. Mahkeme ilk celsede ""suçun unsurları oluşmadı"" diyerek beraat kararı verdi.",26.5.2015
