,url,title,abstract,date
1020,http://www.hurriyet.com.tr/gundem/esenyurtta-copte-bulunan-cesedin-sirri-cozuldu-40428645,Esenyurt’ta çöpte bulunan cesedin sırrı çözüldü,"ESENYURT’ta bıçaklanarak öldürüldükten sonra bir bavula konularak çöpe atılan Suriye uyruklu Muhammet Mameş’in cinayet zanlısı olduğu tespit edilen ev arkadaşı iki şüpheli Hatay’da gözaltına alındı. İstanbul’a getirilen şüphelilerin, cesedi bir bavul içinde çöpe atmak için taşıdığı anlar, güvenlik kameraları tarafından saniye saniye kaydedildi..",15.4.2017
1021,http://www.hurriyet.com.tr/gundem/baba-beni-yalniz-birakma-40427722,'Baba beni yalnız bırakma',"Adana'da ziyaretine geldiği babasını ölü bulan genç kadın ""Baba beni yalnız bırakma, baba gitme"" diyerek gözyaşlarına boğuldu.",14.4.2017
1022,http://www.hurriyet.com.tr/gundem/hamile-yengesini-bicaklayan-sanik-hamile-oldugunu-bilmiyordum-40427647,Hamile yengesini bıçaklayan sanık: Hamile olduğunu bilmiyordum,"Çorum'da 1.5 aylık hamile yengesini sokak ortasında bıçaklayarak bebeğin ölümüne neden olmaktan tutuklu sanık Erhan D.ÿifadesinde, ""Hamile olduğunu bilmiyordum"" dedi.",14.4.2017
1023,http://www.hurriyet.com.tr/gundem/2-kadini-katletmislerdi-birbirlerine-dustuler-40426938,2 kadını katletmişlerdi... Birbirlerine düştüler,"Adana'da boş bir arazide cesetleri bulunan iki kadını oğulları ve iki torunu ile birlikte öldürdüğü iddiasıyla tutuklanan dedenin torununa, ""Cinayeti sen üstlen ben sana cezaevinde bakarım. Senin yaşın küçük çok ceza almazsın"" dediği ileri sürüldü.",14.4.2017
1024,http://www.hurriyet.com.tr/gundem/2-kadini-acimadan-oldurduler-baba-beni-yakma-diye-bagirdi-40426264,2 kadını acımadan öldürdüler! 'Baba beni yakma' diye bağırdı,"Adana’da evlerinden zorla götürülüp, işkence sonrasında da boş tarlada vahşice katledilen Zeliha Sevgilibaş (20) ile akrabası Senem Barık (30) cinayetleriyle ilgili aynı aileden 6 kişi adliyeye sevk edildi.",13.4.2017
1025,http://www.hurriyet.com.tr/gundem/kiz-kardes-canavarlari-40425649,Kız kardeş canavarları,"28 Şubat’ta, Ankara’da bir yol kenarında 6 kurşunla öldürülmüş kadın cesedi bulundu. Cinayet Büro’da kurulan özel ekip, kadının 2 çocuk annesi Özlem Aykutluğ (35) olduğunu belirledi. Özlem’in memleketi Kars’ın Cemre köyündeki 4 erkek kardeşi, çapraz sorguya alındı. Sorguda 4 kardeş, ‘Erkeklerle geziyor’ dedikodusu üzerine aile meclisinin ‘infaz kararı’ aldığını itiraf etti. “Seni İstanbul’a götüreceğiz” diyerek araca bindirildiğinde, Özlem öldürüleceğini anlamış ve katilleri olacak 4 kardeşine, “Ne olur çocuklarımı ortada bırakmayın” demişti. ",12.4.2017
1026,http://www.hurriyet.com.tr/gundem/hrant-dink-cinayeti-sorusturmasinda-2-astsubay-tutuklandi-40425692,Hrant Dink cinayeti soruşturmasında 2 astsubay tutuklandı ,"Hrant Dink cinayeti soruşturması kapsamında gözaltına alınan ve cinayete nezaret ettikleri öne sürülen İstanbul jandarma istihbarat görevlisi iki astsubay, ""kasten öldürme"", ""silahlı terör örgütüne üye olma"" ve ""anayasal düzeni ortadan kaldırmaya teşebbüs etme etme"" suçlarından tutuklandı.",12.4.2017
1027,http://www.hurriyet.com.tr/gundem/damacana-ile-cinayet-testi-40425666,Damacana ile cinayet testi,"Annesinin kuzeni tarafından 12’nci kattan atılan 3.5 yaşındaki Hira’nın ölümü, savcının olay yerinde su dolu şişeyle yaptığı keşif sayesinde aydınlanacak.",12.4.2017
1028,http://www.hurriyet.com.tr/gundem/26-yillik-vicdan-azabi-bu-derede-son-buldu-40425383,26 yıllık vicdan azabı bu derede son buldu,"Sakarya'nın Taraklı ilçesinde, 1991 yılında çocuğunu dereye atarak ölümüne neden olan 50 yaşındaki Ayşe Güven’in cesedi çocuğunu attığı derede bulundu. Ayşe Güven’in yıllardır sık sık çocuğunu suya attığı derenin kenarına gittiği öğrenildi.",12.4.2017
1029,http://www.hurriyet.com.tr/gundem/cinayetten-yasak-ask-cikti-40424672,Cinayetten yasak aşk çıktı,"Ankara'da Astsubay Bekir Uyanık’ın evinin önünde bıçaklanarak öldürülmesinin arkasından, yasak aşk, paylaşılamayan 2 milyon liralık miras çıktı. ",11.4.2017
1030,http://www.hurriyet.com.tr/gundem/adanadaki-vahsetten-son-dakika-bilgisi-zorla-iceri-girdiler-bicakla-tehdit-ettiler-saclarindan-surukleyerek-goturduler-40424054,"Adana'da vahşet: Zorla içeri girdiler, bıçakla tehdit ettiler, saçlarından sürükleyerek götürdüler","ADANA’da Doğan Barık, cezaevinde olan kardeşinin eşi Senem Barık ve arkadaşı Zeliha Sevgilibaş’ı av tüfeğiyle vurarak öldürdü. Cinayetle ilgili 6 kişi gözaltına alındı.  Ailelerinden uzakta kendilerine yeni bir hayat kurmaya çalışan Senem Barık ile Zeliha Sevgilibaş’ı, olaydan 6 saat önce iki otomobille gelenlerin zorla götürdüğünü anlatan komşuları, ""Eve gelip kapıyı zorlayarak içeriye girdiler. Ellerinde bıçak vardı, kadınları saçlarından sürükleyerek arabalara doğru götürdüler. Komşular müdahale etmek isteyince, bıçakla tehdit edip, 'Bu namus meselesi, sadece korkutup bırakacağız, siz karışmayın' diye tehdit ettiler"" diye bilgi verdi.
",11.4.2017
1031,http://www.hurriyet.com.tr/gundem/adanada-vahset-2-kadini-katletti-40423629,Adana'da vahşet! 2 kadını katletti,Adan’da Senem Barık ile arkadaşı Zeliha Sevgilbaş’ın dün gece öldürülmesi olayı ile ilgili cinayet şüphelisi ve 5 akrabası gözaltına alındı.,11.4.2017
1032,http://www.hurriyet.com.tr/gundem/balkondan-duserek-olen-hiranin-babasi-konustu-40423622,Balkondan düşerek ölen Hira'nın babası konuştu,"Mersin’de 12’nci kattaki evlerinin balkonundan düşerek can veren 3.5 yaşındaki Hira Dağ’ın ölümünün ardından konuşan acılı baba Emrah Dağ, tutuklanan kuzeni Türkan İ.’yi suçlayarak, “O kadın planlı bir şekilde çocuğumu öldürdü” iddiasında bulundu",11.4.2017
1033,http://www.hurriyet.com.tr/gundem/yengesi-ile-kadin-arkadasini-oldurdu-40423582,Yengesi ile kadın arkadaşını öldürdü,"Adana'da Doğan Barık, cezaevinde olanÿkardeşinin eşi Senem Barık ve arkadaşı Zeliha Sevgilibaş’ı av tüfeğiyle vurarak öldürdü.",10.4.2017
1034,http://www.hurriyet.com.tr/gundem/emlakci-kadini-evinden-cikarken-oldurduler-40423307,Emlakçı kadını evinden çıkarken öldürdüler,"İstanbul'da emlakçılık yapan 55 yaşındaki Ayşe Melek Öztürk, Beylikdüzü'nde evinden çıkarken uğradığı silahlı saldırı sonucu hayatını kaybetti. Öztürk'ün kızları, annelerinin eski sevgilisi İ.B. tarafından öldürüldüğünü öne sürdü. Polis şüpheli İ.B.'yi arıyor.",10.4.2017
1035,http://www.hurriyet.com.tr/gundem/bebegini-su-kovasinda-bogup-oldurdu-40422959,Bebeğini su kovasında boğup öldürdü,"İzmir’in Karabağlar İlçesi’nde gayri meşru olarak dünyaya getirdiği erkek bebeğini su kovasında boğup öldürdüğü iddiasıyla tutuklu yargılanan 3 çocuk annesi Nazire A., müebbet hapis cezasına çarptırıldı.",10.4.2017
1036,http://www.hurriyet.com.tr/gundem/vanda-iranli-bir-kisi-aracinda-olu-bulundu-40422752,Van’da İranlı bir kişi aracında ölü bulundu,"Van’da İran uyruklu 45 yaşındaki Peiman Azımzadejadi, park halindeki hafif ticari araçta ölü bulundu.",10.4.2017
1037,http://www.hurriyet.com.tr/gundem/son-dakika-mhp-lideri-bahceli-yenikapida-konusuyor-40422004,"MHP lideri Bahçeli: 'Sınırlar değişiyor, Türkiye asıl hedeftir'","İstanbul mitinginde konuşan MHP lideri Devlet Bahçeli, ""Füzeler havalarda uçuşuyor, bombalar peş peşe patlıyor. Yanı başımızda insanlar ölüyor, insanlık can çekişiyor. Sınırlar değişiyor, unutmayın Türkiye asıl hedeftir. Bir olmalıyız, hep birlikte Türkiye’yi müdafaa etmeliyiz"" dedi.&nbsp;",9.4.2017
1038,http://www.hurriyet.com.tr/gundem/adanada-sir-ceset-tek-ipucu-40421090,Adana'da sır ceset! Tek ipucu...,"Adana’da Seyhan Baraj Gölü’nde cesedi bulunan ve Rusya’ya romantizmi getiren şair Vasily Zhukovsky’nin adını koluna dövme olarak yaptıran kadının kimliğini tespit etmeye çalışan polis, kentteki bar ve gece kulüplerinde fotoğrafı ile teşhis yapmaya çalışıyor.",8.4.2017
1039,http://www.hurriyet.com.tr/gundem/emekli-baskomiser-yegenini-oldurdu-40420832,Emekli başkomiser yeğenini öldürdü,"AFYONKARAHİSAR’ın Sandıklı ilçesinde dün akşam, emekli başkomiser Nurettin Çankaya Ece Mahallesi Uzun Çarşı’daki alışveriş merkezinde (AVM) yeğeni Gönül (35) ve eşi Yunus Eryeğen’le (44) karşılaştı. ",7.4.2017
1040,http://www.hurriyet.com.tr/gundem/genc-muhendisin-17-yasindaki-katil-zanlisi-boyle-yakalandi-40420395,Genç mühendisin 17 yaşındaki katil zanlısı böyle yakalandı!,İstanbul Kartal'da bir GSM operatöründe bilgisayar mühendisi olarak çalışan 36 yaşındaki Volkan Karadeli’yi bıçaklayarak öldürdüğü iddia edilenÿ M.A. (17) gözaltına alındı.,7.4.2017
1041,http://www.hurriyet.com.tr/gundem/aranan-suclu-unlu-sarkicinin-evinde-yakalandi-40419783,Aranan suçlu ünlü şarkıcının evinde yakalandı,Adana’da 19 yıl önce öldürülen Mahmut Canpolat cinayetinin azmettiricisi olduğu iddia edilen şüpheli Menderes.Kutlu  İstanbul’da şarkıcı Ceylan Avcı’nın Maslak'taki evinde yakalandı.,7.4.2017
1042,http://www.hurriyet.com.tr/gundem/eski-esinin-sevgilisiyle-kavga-ederken-araya-giren-kisiyi-oldurdu-40419716,"Eski eşinin sevgilisiyle kavga ederken, araya giren kişiyi öldürdü","AYDIN'da, emekli astsubay 44 yaşındaki Murat T., boşandığı eşi Atiye T. ile daire bakmaya giden kadının sevgilisi Mehmet S. ile kavga ederken, araya giren ev sahibi 68 yaşındaki Yaşar Akçakaya'yı tabancayla vurarak öldürdü.",7.4.2017
1043,http://www.hurriyet.com.tr/gundem/kavgayi-ayirmayan-2-polisin-hapsi-istendi-40419600,Kavgayı ayırmayan 2 polisin hapsi istendi,"BEYOĞLU’nda, 4 Temmuz 2015’te 37 yaşındaki Ayhan Kaya, bir tartışma sonrası bıçaklanarak öldürüldü. ",6.4.2017
1044,http://www.hurriyet.com.tr/gundem/bursada-ciftte-cinayetin-suphelisi-yakalandi-40419391,Bursa'da çiftte cinayetin şüphelisi yakalandı,"Bursa’da, aynı gece aynı bölgede yaşanan çifte cinayetin şüphelisi olarak aranan Samet Ş, yakalandı. İki cinayeti de işlemeden önce madde kullandığını ifade eden zanlı, emniyetteki sorgusunun ardından adliyeye sevk edildi.",6.4.2017
1045,http://www.hurriyet.com.tr/gundem/rizede-korkunc-olayin-yasandigi-kat-kapatildi-40419361,Rize'de korkunç olayın yaşandığı kat kapatıldı,"Rize'nin Pazar İlçesi'nde, geçen 20 Mart'ta ders sırasında arkadaşı 16 yaşındaki Emir Taş’ı boynundan bıçaklayarak öldüren, kendini de ağır yaralayan aynı yaştaki B.K.’nın olayı meydana geldiği Pazar Fen Lisesi’nde 9/B sınıfının bulunduğu 1’inci kat eğitime kapatıldı.",6.4.2017
1046,http://www.hurriyet.com.tr/gundem/6-saniyede-gelen-olum-40418502,6 saniyede gelen ölüm,Beyoğlu’nda spor salonu işleten Gökhan Sarı’nın (41) öldüğü eşi Elif Sarı’nın (36) yaralandığı silahlı saldırının güvenlik kamera görüntüleri ortaya çıktı.,5.4.2017
1047,http://www.hurriyet.com.tr/gundem/adresi-yanlis-tarif-ettin-cinayeti-40418504,‘Adresi yanlış tarif ettin’ cinayeti  ,"Engin Bedir (27), geçtiğimiz cuma günü, husumetli olduğu bir Suriyeli’yi bulmak için Esenyurt Kıraç Mahallesi’ne gitti. Burada aradığı kişiyi bir başka Suriyeli Beşar Şaul’a (22) soran Bedir, verilen adrese gitti. Aradığı kişiyi bulamayınca geri dönen Bedir, adresi tarif eden Şaul’u tartıştıktan sonra silahıyla vurarak öldürdü. Polis, Şaul’un cesedininin yanında 19 mermi kovanı buldu.",5.4.2017
1048,http://www.hurriyet.com.tr/gundem/esini-katletmisti-korkunc-detaylar-40418145,Eşini katletmişti! Korkunç detaylar...,"Kağıthane’de boşanma davası açan eşi Nisa Ece İnçke’yi, dışarıdan silah sesinin duyulmaması için televizyonun sesini sonuna kadar açtıktan sonra 3 kez kurşunlayarak öldürdüğü belirtilen Recep İnçke hakim karşısına çıktı. Avukatı olmadığı için savunması alınmayan Recep İnçke, duruşma boyunca başını yerden kaldırmadı. Öldürülen Nisa Ece’nin ağabeyleri, cinayetin planlı olduğunu belirterek sanığın en ağır şekilde cezalandırılmasını talep ettiler.",5.4.2017
1049,http://www.hurriyet.com.tr/gundem/katil-zanlisi-kuzenine-sagdic-olmaya-hazirlanirken-yakalandi-40417173,"Katil zanlısı, kuzenine sağdıç olmaya hazırlanırken yakalandı","Adana'da oto kiralama işi yapan 38 yaşındaki Cem Atalmış’ı, işkence yaptıktan sonra tabancayla öldürüp, cesedini gömdüğü iddiasıyla aranan 33 yaşındaki Deniz Tekin, kuzeninin düğünde sağdıç olmaya hazırlanırken yakalanıp gözaltına alındı. Tekin, polislere ""Düğünden sonra gelseydiniz bari, kuzenimin düğününe katılsaydım"" dediği öğrenildi.",4.4.2017
1050,http://www.hurriyet.com.tr/gundem/rahatsiz-eden-eski-sevgilisini-bicakladi-40417011,Rahatsız eden eski sevgilisini bıçakladı,"Adapazarı'nda 34 yaşındaki T.M. isimli kadın, evlenmesine rağmen kendisini rahatsız ettiği iddiasıyla eski sevgilisi E.G’yi bıçaklayarak yaraladı.",4.4.2017
1051,http://www.hurriyet.com.tr/gundem/iskence-edilerek-vahsice-oldurulmustu-zanlinin-ifadesi-pes-artik-dedirtti-40416959,İşkence edilerek vahşice öldürülmüştü! Zanlının ifadesi 'pes artık' dedirtti,"Adana’da işkence yapılıp tabanca ile öldürüldükten sonra gömülen şahsın ikinci katil zanlısı adliyeye sevk edildi. Zanlının, kuzeninin düğünü için alışveriş yaparken yakalandığı belirtildi.",4.4.2017
1052,http://www.hurriyet.com.tr/gundem/oglu-yaralanan-anne-dehset-sacti-40415663,Oğlu yaralanan anne dehşet saçtı ,"Samsun'da çıkan silahlı kavgada biri çocuk 3 kişi yaralandı.
",3.4.2017
1053,http://www.hurriyet.com.tr/gundem/tedavi-ettirip-dovmusler-korkunc-detaylar-40415528,Tedavi ettirip dövmüşler! Korkunç detaylar...,"Adana'da 10 yıl önce kız kardeşleri Gülşen Yüksel (28) ile erkek arkadaşı Oğuzhan Ekinci’yi (24) öldürdükleri iddiasıyla, 3 ağabeyin de aralarında bulunduğu 14 şüpheli hakkında ağırlaştırılmış müebbet hapis cezası istemiyle dava açıldı.",3.4.2017
1054,http://www.hurriyet.com.tr/gundem/tekirdagda-esrarengiz-cinayetler-40415290,Tekirdağ'da esrarengiz cinayetler ,Tekirdağ'ın Çorlu ilçesinde tüfekle vurulan kayınpeder ile gelini hayatını kaybetti.,3.4.2017
1055,http://www.hurriyet.com.tr/gundem/cinayet-failini-kopegi-yakalatti-40414630,Cinayet failini köpeği yakalattı,"Konya'da evlerinin bulunduğu apartmanın içinde 14 yerinden bıçaklanan ve kaldırıldığı hastanede hayatını kaybeden 30 yaşındaki Murat Baştuğ’un, yaklaşık 100 metre ileride köprü altında bağlı bulunan köpeğin sahibi 31 yaşındaki Yusuf Cığal tarafından öldürdüğü ortaya çıktı. Polisin ise Cığal’ın kimliğini bağlı bulunan ’Zalım’ adlı köpekten yola çıkarak bulduğu, kavganın da köpeğe küfür edildiği iddiasıyla çıktığı belirtildi.

",2.4.2017
1056,http://www.hurriyet.com.tr/gundem/son-sozu-tanimiyorum-oldu-40414441,Son sözü 'tanımıyorum' oldu,"KONYA'da 30 yaşındaki Murat Baştuğ, kimlikleri henüz belirlenemeyen kişi ya da kişilerce 14 yerinden bıçaklanarak öldürüldü.",2.4.2017
1057,http://www.hurriyet.com.tr/gundem/muhtar-gizli-iliski-yuzunden-cinayet-isledi-iddiasi-40414010,"Muhtar, 'gizli ilişki' yüzünden cinayet işledi iddiası","Adana’da kavga ettiği 23 yaşındaki Murat Aygün’ü tabancayla öldüren katil zanlısı mahalle muhtarı 41 yaşındaki Metin G.’nin, Aygün’ün eski yengesiyle ilişki yaşadığı ileri sürüldü.",1.4.2017
1058,http://www.hurriyet.com.tr/gundem/vahset-sopayla-iskence-yapip-gommusler-40413654,Vahşet! Sopayla işkence yapıp gömmüşler,"Adana'da kaybolduktan sonra ev satın almak için 160 bin lira verdiği kişiler tarafından sopayla işkence yapılıp tabanca ile öldürüldükten sonra gömüldüğü ortaya çıkan şahsı, zanlıların ""Eve perde takacağız"" bahanesi ile kandırdığı ortaya çıktı.",1.4.2017
1059,http://www.hurriyet.com.tr/gundem/adanayi-karistiran-cinayet-kundakladilar-40413609,Adana'yı karıştıran cinayet... Kundakladılar,"Adana’da 23 yaşındaki Murat Aygün, kavga ettiği mahalle muhtarı 41 yaşındaki Metin G. tarafından tabancayla vurularak öldürüldü. Cinayet sonrası Metin G.'nin evi kundaklandı.",1.4.2017
1060,http://www.hurriyet.com.tr/gundem/uyandi-tesaduf-dedi-40413564,Uyandı 'tesadüf' dedi,"RİZE'nin Pazar ilçesinde, ders sırasında sınıf arkadaşı 16 yaşındaki Emir Taş'ı boynundan bıçaklayarak öldürdükten sonra kendini de boynundan bıçakla ağır yaralayan lise öğrencisi 16 yaşındaki B.K. tutuklandı. ",31.3.2017
1061,http://www.hurriyet.com.tr/gundem/bir-oda-uc-ceset-aile-trajedisi-40413516,Bir oda üç ceset... Aile trajedisi...,"Ağrı'da cinnet getiren kişi, anne ve babasını av tüfeği ile öldürdükten sonra aynı silahla intihar etti.",31.3.2017
1062,http://www.hurriyet.com.tr/gundem/bursada-yine-kadin-cinayeti-40413362,Bursa’da yine kadın cinayeti,"Bursa’da 42 yaşındaki Mutlu Güngör, iddiaya göre kendini aldattığı gerekçesiyle 37 yaşındaki eşi Ruşen Güngör’ü evde tabancayla öldürdü. Cinayet zanlısı Güngör, kaçmak için para istediği amcasının durumu bildirmesi üzerine polis tarafından yakalandı.",31.3.2017
1063,http://www.hurriyet.com.tr/gundem/sinifta-arkadasini-boynundan-bicaklamisti-ilk-ifadesi-ortaya-cikti-40412843,Sınıfta arkadaşını boynundan bıçaklamıştı! İlk ifadesi ortaya çıktı,Rize'nin Pazar ilçesinde sınıf arkadaşını derste bıçaklayarak öldürdükten sonra kendisini ağır yaralayan lise öğrencisi tutuklanırken ilk ifadesi de ortaya çıktı. ,31.3.2017
1064,http://www.hurriyet.com.tr/gundem/oldurmeden-dinlemis-40412376,Vahşi cinayette korkunç ayrıntı! Öldürmeden dinlemiş...,"Boşanma davası açtığı ve ayrı yaşadığı üç çocuk annesi 16 yıllık karısını sokak ortasında 15 kez bıçaklayarak katleden kocanın, korkunç cinayetten önce eşinin konuşmalarını öğrenmek için evine ‘ses kayıt cihazı’ koydurduğu anlaşıldı.",30.3.2017
1065,http://www.hurriyet.com.tr/gundem/unlu-yazar-cinayeti-davasinda-sok-sozler-2-yil-mesaj-aradim-40412242,Ünlü yazar cinayeti davasında şok sözler: 2 yıl mesaj aradım,"""Melekler ile Yaşamak"" adlı kitabın yazarı ve yaşam koçu Beki İkala Erikli’yi öldüren Sinem Koç ilk kez hakim karşısına çıktı. Mahkemede savunma yapan Koç, Erikli’nin kitaplarından etkilendiğini ve bozulan psikolojisinden Erikli’nin sorumlu olduğunu söyledi. Mahkeme sanığın akli dengesinin yerinde olup olmadığına ilişkin alınacak raporun beklenmesine karar vererek duruşmayı erteledi. ",30.3.2017
1066,http://www.hurriyet.com.tr/gundem/esini-sokakta-olduren-adama-agirlastirilmis-muebbet-40412156,Eşini sokakta öldüren adama ağırlaştırılmış müebbet,Manisa’da kendisinden ayrılan eşi Meltem Ece’yi sokakta bıçaklayarak öldüren Emrah Ece’ye ağırlaştırılmış müebbet hapis cezası verildi.,30.3.2017
1067,http://www.hurriyet.com.tr/gundem/susma-hakkindan-vazgecip-konustu-suclamayi-reddetti-40411975,"Susma hakkından vazgeçip konuştu, suçlamayı reddetti","ADANA'nın Kozan İlçesi'nde salı gecesi aynı aileden 5 kişiyi öldürdüğü iddiasıyla gözaltına alınan İbrahim A. susma hakkından vazgeçip ifade verdi, ancak suçlamayı kabul etmedi. İfadesindeki bilgilere dayanılarak, bir katliam zanlısı daha belirlendi.",30.3.2017
1068,http://www.hurriyet.com.tr/gundem/ev-almak-icin-gitti-olduruldu-40411769,"Ev almak için gitti, öldürüldü","Adana’da 21 Mart günü, eşine ’ev almak için görüşmeye gidiyorum’ diyerek evden çıkan 38 yaşındaki Cem Atalmış’ın, işkence yapıldıktan sonra öldürüldüğü ortaya çıktı. Katil zanlılarından 33 yaşındaki Mehmet Tekin, İstanbul’un Silivri ilçesinde yakalandı.",30.3.2017
1069,http://www.hurriyet.com.tr/gundem/arabanin-arkasina-saklanip-oldurmustu-esini-gizlice-dinlettigi-ortaya-cikti-40411427,Arabanın arkasına saklanıp öldürmüştü! Eşini gizlice dinlettiği ortaya çıktı,"Bursa’da, boşanma davası açtıktan sonra kendisinden ayrı yaşayan 16 yıllık eşini, yolda yürürken takip edip 15 bıçak darbesi ile öldüren Tahsin Taner A. hakkındaki savcılık soruşturması tamamlandı. Hazırlanan iddianamede Tahsin Taner A.’nın, oğlu aracılığı ile hakkında koruma kararı verilen öldürdüğü eşinin konuşmalarını kayda almak için eve gizlice dinleme cihazı koyduğu ve cinayet anında Fatma A.’ya, ""Ben sana demedim mi, benimle oğlumun yüzünü yere eğdirmeyeceksin. Değer miydi bir Allahsız için bizi parçaladığına"" dediği belirtildi.",30.3.2017
1070,http://www.hurriyet.com.tr/gundem/bagaj-cinayetinden-taciz-cikti-40411264,Bagaj cinayetinden taciz çıktı,"DENİZLİ’nin Merkezefendi İlçesi’nde, yol kenarındaki hafif ticari aracın bagajında boğazı kesilerek öldürülen 51 yaşında Mustafa Ilçak’ın, taciz ettiği bir kadın ve iki yakını tarafından öldürüldüğü ortaya çıktı.",29.3.2017
1071,http://www.hurriyet.com.tr/gundem/iki-kadinin-cinayet-sanigina-muebbet-ve-40-yil-hapis-40410524,İki kadının cinayet sanığına müebbet ve 40 yıl hapis,"Antalya'da 2004 ile 2009 yıllarında 2 kadını öldürmekle suçlanan 34 yaşındaki Mehmet Güneş, ağırlaştırılmış müebbet ve 40 yıl hapis cezasına çarptırıldı.

",29.3.2017
1072,http://www.hurriyet.com.tr/gundem/kendisini-bicakla-yaralayani-olduren-saniga-15-yil-hapis-40410491,Kendisini bıçakla yaralayanı öldüren sanığa 15 yıl hapis,"Kayseri'de kendisini bıçakla yaralamasına rağmen şikayetçi olmadığı kişiyi olaydan yaklaşık bir ay sonra av tüfeğiyle vurarak öldüren sanık 15 yıl, yanındaki arkadaşı ise 12 yıl 6 ay hapis cezasına çarptırıldı.",29.3.2017
1073,http://www.hurriyet.com.tr/gundem/istanbulda-esrarengiz-cinayetler-fuhus-yok-ask-var-deyip-oldurduler-40410192,İstanbul'da esrarengiz cinayetler: 'Fuhuş yok aşk var' deyip öldürdüler ,"İstanbul Fatih'te son 4 günde birbirine yakın yerlerde 3 cinayet işlendi. 2 kadın 1 erkeğin öldürüldüğü cinayetlerin birbiriyle bağlantısı araştırılıyor. Birbirlerine yakın bölgede işlenen her iki cinayeti araştıran polis, olayların ortak noktasının hayat kadınları olduğunu tespit etti.",29.3.2017
1074,http://www.hurriyet.com.tr/gundem/hrant-dink-cinayetinde-8-supheli-tutuklandi-40410025,Hrant Dink cinayetinde 8 şüpheli tutuklandı,"Hrant Dink cinayeti soruşturması kapsamında gözaltına alınan, aralarında gazeteci, emniyet ve jandarma görevlilerinin de bulunduğu 8 şüpheli, “silahlı terör örgütüne üye olma” ve “anayasal düzeni ortadan kaldırmaya teşebbüs” suçlarından tutuklandı",28.3.2017
1075,http://www.hurriyet.com.tr/gundem/eski-esi-ile-oz-kizini-oldurup-intihara-kalkisti-40410010,"Eski eşi ile öz kızını öldürüp, intihara kalkıştı","Hatay'ın İskenderun İlçesi’nde 29 yaşındaki Gökhan Yıldız, eski eşi 28 yaşındaki Esra Yalçın ve 5 yaşındaki kızı Beren Yıldız’ı bıçaklayarak öldürdükten sonra yaşamına son vermeye çalıştı.&nbsp;",28.3.2017
1076,http://www.hurriyet.com.tr/gundem/ceket-asma-kavgasinda-sarkici-oldu-40409469,Ceket asma kavgasında şarkıcı öldü,"Eskişehir'de eğlence merkezinde 'ceket asma' yüzünden çıkan bıçaklı kavgada, müzisyen Seydihan Çalışkanoğlu bıçaklanarak hayatını kaybetti.",28.3.2017
1077,http://www.hurriyet.com.tr/gundem/silivride-oldurulen-kadinin-cinayet-suphelisi-intihar-etti-40409462,Silivri’de öldürülen kadının cinayet şüphelisi intihar etti,İstanbul&nbsp;Silivri İlçesi’nde ormanlık alanda başından ve sağ kolundan pompalı tüfekle vurularak öldürülen kadın cesedinin 39 yaşındaki Demet Genç’e ait olduğu belirlendi. Genç’in katil zanlısı olarak aranan 49 yaşındaki Celalettin Yaran ise Tekirdağ’ın Çerkezköy ilçesinde av tüfeğiyle yaşamına son verdi.,28.3.2017
1078,http://www.hurriyet.com.tr/gundem/ev-arkadasini-oldurmustu-karar-verildi-40409377,Ev arkadaşını öldürmüştü! Karar verildi,"Antalya’da aynı evde kaldığı iş arkadaşı 46 yaşındaki Ünal Duran’ı av tüfeğiyle öldürmekten yargılanan çatı ustası 26 yaşındaki Rifat Çınar, 18 yıl 6 ay hapse mahkum edildi. Çınar, ""Eskişehir’den tüfek getirdim ancak bu olay istemeden oldu. Beni cezalandırmanızı istemiyorum. Olmamış olsaydı iyi olurdu. Pişmanım"" dedi.",28.3.2017
1079,http://www.hurriyet.com.tr/gundem/bicakili-dehset-2-olu-1-agir-2-yarali-40409309,"Bıçaklı dehşet: 2 ölü, 1 ağır 2 yaralı ","Manisa’nın Salihli ilçesinde çıkan bıçaklı kavgada 1’i kadın 2 kişi hayatını kaybederken, 1’i ağır 2 kişi de yaralandı.",28.3.2017
1080,http://www.hurriyet.com.tr/gundem/kocasi-5-yillik-sevgilisini-oldurttu-dna-testi-soke-etti-40409201,Kocası 5 yıllık sevgilisini öldürttü! DNA testi şoke etti,"Bursa’da, evli 4 çocuk annesi 32 yaşındaki Neşe A.’nın, öldürdüğü komşusu 30 yaşındaki Ümit Şahin ile 5 yıldır sevgili olduklarının ve kadının Y. adındaki çocuğunun Ümit Şahin’den olduğunun DNA testiyle ortaya çıkmasından sonra cinayet ile ilgili iddianame hazırlandı. Savcılık, Neşe A. hakkında ’adam öldürmek’ suçundan, eşi Mehmet A. hakkında da ’Cinayete azmettirmek’ suçundan ömür boyu hapis cezası istemiyle dava açtı.",28.3.2017
