,url,title,abstract,date
111,http://www.hurriyet.com.tr/gundem/isid-hutbesi-40016289,IŞİD hutbesi,"Diyanet İşleri Başkanlığı, Türkiye, Suriye, Fransa’da katliamlar yapan IŞİD’in, kanlı bir terör örgütü olduğunu ve yaptıklarının İslam’la uzaktan yakından ilgisi olmadığını anlatan bir hutbe hazırladı. Hutbe bugün Türkiye ve Avrupa’daki camilerde okunacak.",19.11.2015
112,http://www.hurriyet.com.tr/gundem/samsunda-brezilya-dizisi-gibi-olay-40015967,Samsun'da Brezilya dizisi gibi olay!,Samsun'da yıllarca babaları bildikleri adamın öz babalarını öldürdüğünü öğrenen üç kardeşe bir şok daha. Mahkemenin isteği üzerine yapılan DNA testinde ablalarının da üvey olduğu ortaya çıktı.,19.11.2015
113,http://www.hurriyet.com.tr/gundem/18-yil-siddet-23-kursunla-cinayet-40015850,18 yıl şiddet&nbsp;23 kurşunla cinayet,"Emine Canan Şahin, evliliği boyunca kocası Ayhan Şahin’in işkencelerine maruz kaldı. En sonunda 23 kurşunla öldürüldü. İşte 18 yıllık evliliği boyunca şiddet gören Canan’ın hikâyesi.",18.11.2015
114,http://www.hurriyet.com.tr/gundem/cinayetten-sonra-caldigi-dovizi-bozdururken-guvenlik-kameralarina-yakalandi-40015791,Cinayetten sonra çaldığı dövizi bozdururken güvenlik kameralarına yakalandı,"Adana'da&nbsp;&nbsp;70 yaşındaki Osman Efe’yi bıçaklayarak öldüren 39 yaşındaki Selma Cingöz’ün, cinayetten sonra evden 8 bin 500 Euro çaldığı ortaya çıktı. Cingöz, kızıyla birlikte gittiği döviz bürosunda çaldığı parayı bozdururken güvenlik kameralarınca görüntülendi.",18.11.2015
115,http://www.hurriyet.com.tr/gundem/bahceliden-ilk-grup-toplantisinda-sert-sozler-40015089,Bahçeli'den ilk grup toplantısında sert sözler,"MHP Genel Başkanı Devlet Bahçeli, TBMM’de partisinin grup toplantısında konuştu. &nbsp;Bahçeli, ""Türkiye, medya özgürlüğü, kişi hak ve güvenliği liginde küme düşmüştür. Başörtülü kadınlara kelepçe vurulan ülkenin ismi Türkiye’dir. Sonra dönüp başörtüsünün toplumda olumlu algılandığını söyleyen ve başı açıkları tahkir eden valilerin görev yaptığı ülkenin ismi Türkiye’dir” dedi.",17.11.2015
116,http://www.hurriyet.com.tr/gundem/sizofren-oglunu-olduren-baba-ceza-almadi-40015064,Şizofren oğlunu öldüren baba ceza almadı,"Adana’da kendisine ve eşine satırla saldıran şizofreni hastası oğlu 34 yaşındaki Serkan Teker’i av tüfeğiyle vurarak öldüren baba 59 yaşındaki Ramazan Teker, eyleminin ’meşru müdafa’ sınırlarında kaldığı gerekçesiyle ceza almadı.",17.11.2015
117,http://www.hurriyet.com.tr/gundem/bir-saygin-katil-daha-40014880,Bir saygın katil daha,"Diyarbakır’da geçen 14 Şubat’ta 3 çocuk annesi eşini bıçaklayarak öldüren sanığa ağırlaştırılmış ömür boyu hapis cezası veren mahkeme, haksız tahrik ve saygın tutum indirimi uygulayarak cezayı 20 yıla indirdi.",16.11.2015
118,http://www.hurriyet.com.tr/gundem/polis-kafatasindaki-curuk-disten-cinayeti-cozdu-40014809,"Polis, kafatasındaki çürük dişten, cinayeti çözdü","KAYSERİ’de 8 ay önce bir dere içerisinde bulunan kafatasını inceleyen polis ekipleri, çürük dişten yola çıkarak kafatasının kime ait olduğunu belirledi ve cinayete kurban gittiğini ortaya çıkardı. Olayla ilgili gözaltına alınan 5 şüpheliden 2’si tutuklandı.",16.11.2015
119,http://www.hurriyet.com.tr/gundem/sevgililer-gunu-cinayetine-tahrik-ve-saygin-tutum-indirimi-40014559,Sevgililer Günü cinayetine 'tahrik' ve 'saygın tutum' indirimi,"DİYARBAKIR’da geçen 14 Şubat Sevgililer Günü'nde 3 çocuk annesi eşini bıçaklayarak öldüren sanığa ağırlaştırılmış ömür boyu hapis cezası veren mahkeme, haksız tahrik ve saygın tutum indirimi uygulayarak cezayı 20 yıla indirdi. Mahkemenin üye hakimi haksız tahrik indirimine muhalefet ederken, mağdur avukatı Özden Sanal temyiz başvurusu yaptı.",16.11.2015
120,http://www.hurriyet.com.tr/gundem/manisada-konkunc-cinayet-2-olu-40013126,Manisa'da konkunç cinayet: 2 ölü,"cinayetManisa'nın Akhisar ilçesinde, bir kişi boşandığı eşi ve eski kayınpederini, sokakta pompalı tüfekle öldürdü.
",12.11.2015
121,http://www.hurriyet.com.tr/gundem/erkekler-2015te-236-kadini-oldurdu-40012638,Erkekler 2015'te 236 kadını öldürdü,"Bianet'in yerel ve ulusal gazetelerden, haber sitelerinden ve ajanslardan derlediği haberlere göre, Ekim 2015’te erkekler 25 kadın öldürdü; 15 kadın ve kız çocuğuna tecavüz etti; 5 kadın ve kız çocuğuna zorla fuhuş yaptırdı; 29 kadını yaraladı; 6 kadın ve kız çocuğuna cinsel tacizde bulundu.",11.11.2015
122,http://www.hurriyet.com.tr/gundem/esiyle-iliski-yasadigini-dusundugu-adami-sokak-ortasinda-oldurdu-40012396,Eşiyle ilişki yaşadığını düşündüğü adamı sokak ortasında öldürdü,"Uşak'ta mağaza satış görevlisi ve eski öğretmen, bir çocuk babası H.G., eşiyle ilişkisi olduğunu iddia ettiği özel güvenlik görevlisi Seyit Çakırbay'ı yol ortasında defalarca bıçaklayarak öldürdü. Cinayet anı güvenlik kameralarına yansırken yoldan geçen insanların olaya duyarsız kalmaları dikkat çekti.",10.11.2015
123,http://www.hurriyet.com.tr/gundem/miras-icin-tartistigi-kiz-kardesi-ve-enistesini-oldurup-yegenini-yaraladi-40011271,"Miras için tartıştığı kız kardeşi ve eniştesini öldürüp, yeğenini yaraladı","İzmir’in Kemalpaşa İlçesi’nde, babalarından miras olarak kalan ev, tarla ve bahçenin satışı konusunda anlaşamadıkları ileri sürülen iki kardeş arasında çıkan kavgada kan döküldü. Tartışmada, kız kardeşi Gülten (45) ve eniştesi Sedat Foçadan’ı (51) tabancayla öldürüp, yeğeni Selin Foçadan’ı (20) da yaralayan emekli banka müdürü A.C. (55) polis tarafından gözaltına alındı.",7.11.2015
124,http://www.hurriyet.com.tr/gundem/esine-kaynar-su-doken-supheli-yanlis-anlasilma-var-dedi-40011171,"Eşine kaynar su döken şüpheli ""yanlış anlaşılma var"" dedi ","İstanbul Küçükçekmece’de eşinin üzerine kaynar su dökerek ağır şekilde yaralanmasına neden olduğu iddiasıyla gözaltına alınan Yunus E. adliyeye çıkarıldı. Yunus E. adliyeye giderken ""Yanlış anlaşılma oldu. Ben yapmadım"" dedi. Şüpheli, polisteki ifadesinde makarna tenceresinin yanlışlıkla eşinin üzerine döküldüğünü söyleyerken, halen hastanede tedavi gören Zeynep E.'nin ise 15 yıllık eşinden kendisini kaynar su dökerek yaraladığı iddiasıyla şikayetçi olduğu öğrenildi.",7.11.2015
125,http://www.hurriyet.com.tr/gundem/babasini-oldurup-parcalara-ayirdi-40010947,Babasını öldürüp parçalara ayırdı,"Vatani&nbsp;görevini yaptığı Çanakkale’den psikolojik sorunlarından dolayı hava değişimi alan Bilal K., gittiği memleketi Ağrı’da babasını keserek öldürdü.&nbsp;",6.11.2015
126,http://www.hurriyet.com.tr/gundem/karisini-hapsetti-kaynar-suyla-hasladi-kacti-yakalandi-40010900,"Karısını hapsetti, kaynar suyla haşladı, kaçtı, yakalandı","Her geçen gün bir kadın cinayeti haberinin geldiği Türkiye'de dün de İstanbul'dan korkunç bir haber geldi. Küçükçekmece'de oturan Zeynep E, gözü dönmüş kocası tarafından kaynar suyla yakıldı. Yunus E, vücudunun büyük bölümünde yanıklar olan karısını 2 gün evde hapsetti. Zeynep E. ""Babasına kurtar beni"" diye mesaj attı. Cani koca, polis ekiplerinin çabası sonucunda yakalandı.",6.11.2015
127,http://www.hurriyet.com.tr/gundem/elektrosok-tabancali-gasp-cetesi-cokertildi-40010880,Elektroşok tabancalı gasp çetesi çökertildi,"İstanbul’da, cinayetten adam yaralamaya, gasptan hırsızlığa kadar 38 olay gerçekleştirdikleri belirtilen, elebaşılığını 13 suçtan aranan S.D’nin yaptığı 9 kişilik çete Asayiş Şube Müdürlüğü ekipleri tarafından çökertildi. Çeteden elektroşok tabanca, Kaleşnikof tüfek, 2 tabanca, kar maskeleri ele geçirildi.&nbsp;",6.11.2015
128,http://www.hurriyet.com.tr/gundem/savci-tahir-elci-icin-7-5-yila-kadar-hapis-istedi-40010724,"Savcı, Tahir Elçi için 7.5 yıla kadar hapis istedi","Bir televizyon programında ""PKK terör örgütü değildir"" dediği için hakkında soruşturma başlatılan Diyarbakır Barosu Başkanı Tahir Elçi hakkında ""Terör örgütü propagandası"" suçundan 7.5 yıla kadar hapis cezası istemiyle hazırlanan iddianame kabul edildi.",6.11.2015
129,http://www.hurriyet.com.tr/gundem/deger-denizin-katil-zanlisi-esini-olumle-tehdit-etmis-40010562,"Değer Deniz'in katil zanlısı, eşini ölümle tehdit etmiş","Müzisyen Değer Deniz’i hırsızlık için girdiği evde, tecavüz edip öldüren katil zanlısı C.M.’nin çocuk gelin olan eşi A.U., ""İnsan olan böyle bir cinayet işler mi? O kadına çok yazık oldu. Oğlunu düşünseydi yapmazdı"" dedi. Genç kadın, C.M.’nin cezaevinden kendisini öldüreceğine dair haber yolladığını söyledi.",6.11.2015
130,http://www.hurriyet.com.tr/gundem/cizre-jitem-davasinda-saniklara-beraat-karari-40010485,Cizre JİTEM Davası'nda sanıklara beraat kararı,"Şırnak’ın Cizre ilçesinde 1993-1995 yılları arasında meydana gelen 20 faili meçhul cinayetle ilgili olarak haklarında dava açılan, aralarında emekli Albay Cemal Temizöz ile Cizre eski Belediye Başkanı Kamil Atağ’ın da bulunduğu 8 tutuksuz sanığın tamamı beraat etti. Duruşmaya sanıklardan Adem Yakin'in ""Jitem’de çalışmadım. Jitem’in ne olduğunu bilmem. Ben bir tek Jötem’i bilirim. O da Fransızca seni seviyorum demektir"" sözleri damga vurdu.",5.11.2015
131,http://www.hurriyet.com.tr/gundem/medet-onlu-cinayetinde-mit-baglantisi-iddiasi-40010234,Medet Önlü cinayetinde MİT bağlantısı iddiası,"Çeçen İçkerya Devleti Fahri Konsolosu Medet Önlü cinayeti davasında tanık olarak dinlenen kardeşi Ali Önlü, Önlü’nün Çeçen savaşçıların Suriye’ye gönderilmesinde yardımcı olması için MİT’ten gelen teklifi kabul etmediğini, ağabeyinin öldürülmesinde bu bağlantının da göz önünde bulundurulmasını istedi.",5.11.2015
132,http://www.hurriyet.com.tr/gundem/muzisyen-deger-denizin-katili-sozleri-erkekligime-dokundu-oldurdum-40009940,"Müzisyen Değer Deniz’in katili: Sözleri erkekliğime dokundu, öldürdüm","Müzisyen Değer Deniz’in öldürülmesine ilişkin davada ilk kez hakim karşısına çıkan sanık C.M., sevgili olduklarını ve cinayeti ‘erkekliğine hakaret edildiği’ için işlediğini savundu. Deniz ailesinin avukatlarından Çiğdem Hacısoftaoğlu ise sanığın haksız tahrik indiriminden faydalanmak ve daha az ceza almak amacıyla böyle bir savunma yaptığını belirterek, ''Bu davada sanığın ‘Erkekliğime laf söylediğini iddia edersem kurtulurum cezadan’ düşüncesine kapılmasının tek nedeni, kendinden önceki kadın katillerinin benzer savunmalarla az cezalar almaları'' dedi.",4.11.2015
133,http://www.hurriyet.com.tr/gundem/tecavuzle-sonuclanan-kadin-cinayeti-40009638,Değer Deniz'in kardeşi: ‘Tecavüzle sonuçlanan kadın cinayeti’,"İstanbul Beyoğlu'ndaki evinde ölü olarak bulunan müzisyen Değer Deniz'in katil zanlısının yargılanmasına başlandı. İstanbul Adalet Sarayı önünde basına konuşan maktulün kardeşi Orhan Deniz, “Değerimiz aramızda artık yok. Bunun sebebi de bir hırsızlık ya da şans eseri bir şey değil. Tecavüzle sonuçlanan bir kadın cinayetidir"" dedi. ",3.11.2015
134,http://www.hurriyet.com.tr/gundem/reklamci-serap-intihar-etmemis-bogularak-oldurulmus-40009209,Reklamcı Serap intihar etmemiş boğularak öldürülmüş,"İzmir’in Karşıyaka İlçesi’nde, iki gündür kendisinden haber alınamayınca eve giren polisler tarafından ölü bulunan ve cesedinin yanında tarım ilacı kutusu olduğu fark edilince intihar ettiği düşünülen 38 yaşındaki Serap Çiçek’in boğularak öldürüldüğü ortaya çıktı. Çiçek’in katil zanlısı olarak gözaltına alınan erkek arkadaşı 52 yaşındaki O.B., işlemlerinin ardından sevk edildiği adliyede tutuklandı.
",2.11.2015
135,http://www.hurriyet.com.tr/gundem/esinin-terk-ettigi-adam-katliam-yapti-40009114,"İki ilde terk edilen koca dehşeti: 4 ölü, 2 polis yaralı","Balıkesir’in Gönen İlçesi’nde, evi terk eden eşi 57 yaşındaki Fatma Şenses, kayınvalidesi 83 yaşındaki Fatma Yılmaz ve kayınbiraderi 49 yaşındaki İsmail Yılmaz’ı tabancayla kurşun yağdırarak öldüren 67 yaşındaki Salih Şenses, kaçtığı Bandırma İlçesi’nde otomobilinde intihar etmek isterken yakalandı. Kütahya'da ise ayrılmak üzere olduğu karısını silahla vurarak öldüren Erhan T. 2 polis memurunu yaraladı. ",2.11.2015
136,http://www.hurriyet.com.tr/gundem/kahveye-giderken-sirtindan-vuruldu-40008328,Kahveye giderken sırtından vuruldu,"Adana'’da arkadaşları ile sokakta yürüyen 34 yaşındaki Celal Adar, kimliği belirsiz bir kişinin açtığı ateş sonucu sırtından vurularak ağır yaralandı.",31.10.2015
137,http://www.hurriyet.com.tr/gundem/baskin-yaptigi-evde-kendi-silahiyla-oldu-40008324,Baskına gittiği evde kendi silahıyla öldü,"Tekirdağ'ın&nbsp;Çorlu ilçesinde aralarında daha önce husumet olduğu belirtilen Ramazan D.’nin evine giden 47 yaşındaki Abidin Duran, belinden çıkardığı silahla ateş etmek istediği sırada araya girip elinden tabancayı alan 17 yaşındaki A.D. tarafından 5 kurşunla öldürüldü. Ramazan D.’nin yeğeni olan A.D. ile evdeki 2 kişi gözaltına alındı.",31.10.2015
138,http://www.hurriyet.com.tr/gundem/sahte-icki-sorusturmasinda-gozaltina-alinanlar-bize-etil-yerine-metil-alkol-satanlardan-sikayetciyim-40008245,"Sahte içki soruşturmasında gözaltına alınanlar: ""Bize etil yerine metil alkol satanlardan şikayetçiyim""","İSTANBUL’da çok sayıda kişinin ölümüne neden olan sahte içki soruşturmasında gözaltına alınan 21 kişi adliyeye sevk edildi. Soruşturma sonucunda ölümlere neden olan sahte içkinin 3 ayrı depoda üretildiği belirlendi. Şüphelilerin Karaköy’de bir depodan aldıkları ve etil alkol sandıkları metil alkolü sahte içki yapımında kullanınca ölümlere sebep olduğunu söyledikleri öğrenildi. Sahte içki yapımını internetten öğrendiğini söyleyen şüphelilerden Hikmet B., ''Ekim ayının başlarında polis beni yakalamıştı. Ancak mahkemeden serbest kaldım. Dışarı çıkınca yeniden ekipmanı mı kurup çalışmaya başladım'' dedi.",31.10.2015
139,http://www.hurriyet.com.tr/gundem/mhp-genel-baskani-devlet-bahceliden-sonra-oktay-vuraldan-da-trtye-tepki-40008229,MHP Genel Başkanı Devlet Bahçeli’den sonra Oktay Vural’dan da TRT’ye tepki ,"MHP Genel Başkanı Devlet Bahçeli’nin Osmaniye’deki gezisi sırasında TRT’ye ait mikrofonu istememesinin ardından TRT’de yayınlanan ’Fetret’ adlı belgesele tepki göstermek için açıklama yapan Grup Başkanvekili Oktay Vural da görüntü alan TRT ekibine tepki gösterdi. Vural, ""Buraya ne geliyorsunuz? Ne diye geliyorsunuz? Böyle bir rezalet olmaz. İstemiyorum TRT’yi. Genel başkanımızın istemediğini ben ne yapayım? Yeter artık be. Bu talimatları veren, bunların yayınlanmamasını söyleyenler, er ya da geç hesabını vereceklerdir. Onlar hakkında da bizi belgesel hazırlayacağız"" dedi. ''Eğer TRT belgesel yapmak istiyorsa, çıkın Oslo’daki belgeleri açıklayın'' diyen Vural, sözlerine şöyle devam etti: ''Oslo’da ne görüşüldü? Kirli pazarlıklar nelerdi? AKP’li vekiller bu toplantılara katıldı mı? Kandil’deki kriptolu telefonları kim verdi? Kandil'dekileri özel uçakla Oslo’ya kim götürdü?''",31.10.2015
140,http://www.hurriyet.com.tr/gundem/sahte-alkolden-gozaltina-alinanlarin-sayisi-21-oldu-40008144,Sahte alkolden gözaltına alınanların sayısı 21 oldu,"İstanbul'da sahte içki ürettiği, temin ettiği ve sattığı iddiasıyla gözaltına alınanların sayısı 21’e yükseldi.  Polis, yaklaşık 5 bin şişe ölümcül içkinin piyasada olduğunu tespit etti. Sahte içki şişelerinin çoğu ele geçirildi ama yetkililer vatandaşları uyarıyor: 'Ucuz içkiden uzak durun'",31.10.2015
141,http://www.hurriyet.com.tr/gundem/sahte-ickiden-zehirlenen-kisinin-babasi-konustu-leblebi-gibi-satiliyor-40007892,Sahte içkiden zehirlenen kişinin babası konuştu: Leblebi gibi satılıyor,"İstanbul'da sahte içkiyle ilgili düzenlenen operasyonda, 4 kişi daha gözaltına alındı, böylece gözaltına alınanların sayısı 19'a yükseldi. Fatih’te sahte içkiden zehirlenen 40 yaşındaki Ufuk Çelik’in tedavisi de Samatya’daki İstanbul Eğitim ve Araştırma Hastanesi Yoğun Bakım Servisi’nde devam ediyor. ",30.10.2015
142,http://www.hurriyet.com.tr/gundem/sanliurfada-2-suriyeli-gazeteci-bogazlari-kesilerek-olduruldu-40007865,Şanlıurfa'da 2 Suriyeli gazeteci boğazları kesilerek öldürüldü,"Şanlıurfa’da haftalık Arapça yayınlanan ’Ayn Vatan’ gazetesinin Yazı İşleri Müdürü İbrahim Abdulkadir ile muhabiri Firaz Hamadi bıçakla boğazları kesilerek öldürüldü. Suriyeli gazetecilerin IŞİD militanları tarafından öldürüldüğü sanılırken, 7 kişi gözaltına alındı.",30.10.2015
143,http://www.hurriyet.com.tr/gundem/bakanlik-8-olu-var-13-kisinin-durumu-agir-40007616,Bakanlık: 8 ölü var 13 kişinin durumu ağır,"Sağlık Bakanlığı, İstanbul’da sahte içki sonucu zehirlenerek ölenlerle ilgili açıklama yaptı. Soruşturmayı yürüten Cinayet Büro Amirliği yetkilileri ölü sayısının 12’ye yükseldiğini duyurmuştu. Bakanlık ise, 8 kişinin hayatını kaybettiğini, hastanelerde tedavi gören 13 kişinin hayati tehlikesi bulunduğunu belirtti. Bakanlık açıklamasında kendileri dışındaki kaynaklara itibar edilmemesini vurguladı. ",29.10.2015
144,http://www.hurriyet.com.tr/gundem/sahte-icki-faciasinda-olu-sayisi-artiyor-40007605,Sahte içki faciasında ölü sayısı artıyor,İSTANBUL’da alkol zehirlenmelerinde ölüm sayısı artıyor. Hastanelerde tedavi gören 3 kişinin de hastanede hayatını kaybetmesiyle ölü sayısı emniyet kaynaklarına göre 12’ye yükseldi.,29.10.2015
145,http://www.hurriyet.com.tr/gundem/sahte-icki-organize-cete-isi-cikti-40007562,Sahte içki organize çete işi çıktı,"İSTANBUL’da 9 kişinin hayatını kaybettiği kaçak alkol soruşturmasında gözaltı sayısı 15’e yükseldi. Hastanelere gelen şüpheli ölümleri araştıran polis, gözaltına aldığı şüphelilerin üretim ve dağıtım ağı oluşturduklarını organize bir şekilde çalıştıklarını tespit etti. Öte yandan çete elebaşılarından  M.K’nın  kaçak yaptığı içkileri önce kendisinin tatdığı  ve iki gün yoğun bakımda kaldıktan sonra yine üretimin başına döndüğü  ortaya çıktı.",29.10.2015
146,http://www.hurriyet.com.tr/gundem/pendikte-kadin-cinayeti-40007371,Pendik’te kadın cinayeti,"İstanbul Pendik’te araçta tartıştığı eşine 6 el ateş edip öldürdükten sonra 155’i arayan koca, olay yerine gelen polislere teslim oldu.",29.10.2015
147,http://www.hurriyet.com.tr/gundem/istanbulda-sahte-icki-soku-olenlerin-sayisi-9a-yukseldi-40007308,İstanbul'da sahte içki şoku: Ölenlerin sayısı 9'a yükseldi,"İstanbul’da sahte içkiden zehirlenen çok sayıda kişi hastanelere kaldırıldı. Yetkililer, şu ana kadar 9 kişinin hayatını kaybettiğini belirtirken, yoğun bakımda çok sayıda kişi olduğu öğrenildi. Polis, yaptığı operasyonda, şu ana kadar sahte içki üretimi ve satışına adı karışan 15 kişiyi gözaltına aldı. Şüphelilerin sorgusu Cinayet Büro Amirliği'nde sürüyor.",28.10.2015
148,http://www.hurriyet.com.tr/gundem/sevgilisinin-kocasindan-saklanirken-pencereden-dustu-40007037,Sevgilisinin kocasından saklanırken pencereden düştü,"Elazığ polisi dere kenarında bulunan erkek cesedinin sırrını çözdü. Kurbanın yasak ilişki yaşadığı kadının kocasından saklanırken pencereden düştüğü, cesedini ise sevgilisinin taşıdığı ortaya çıktı.",28.10.2015
149,http://www.hurriyet.com.tr/gundem/nuh-albayrak-mehmet-ali-sahini-elestirdi-40006977,"Nuh Albayrak, Mehmet Ali Şahin'i eleştirdi","Star Gazetesi'nin Genel Yayın Yönetmeni, AK Parti'nin kurucularından eski Başbakan Yardımcısı Bülent Arınç'la girdiği polemiğin ardından bu kez de AK Parti'nin Genel Başkan Yardımcısı Mehmet Ali Şahin'i isim vermeden eleştirdi. ",28.10.2015
150,http://www.hurriyet.com.tr/gundem/asitli-saldirida-aileden-ilk-aciklama-40006376,Asitli saldırıda aileden ilk açıklama,"Ataşehİr’de bir kebapçıda teyzesinin kocasının asitli saldırısında yüzü ve gözleri yanan 3.5 yaşındaki Y.K.’nin günlerdir suskunluğunu koruyan ailesi, önceki gün yazılı bir açıklama yaparak, saldırganın yakalanmasında &nbsp;rol oynayan polislere ve tedavisini yapan doktorlara &nbsp;teşekkür etti.&nbsp;",26.10.2015
151,http://www.hurriyet.com.tr/gundem/garnizon-komutaninin-esini-olduren-saniga-muebbet-40006275,Garnizon komutanının eşini öldüren sanığa müebbet,"Çekmeköy Garnizon Komutanı'nın eşi Sultan Kaymaz'ı öldürdüğü gerekçesiyle yargılanan Ziyaettin Yaraşır, ""Kasten öldürme"" suçunu işlediği gerekçesiyle müebbet hapis cezasına çarptırıldı.",26.10.2015
152,http://webtv.hurriyet.com.tr/haber/canli-yayindaki-itirafin-ardindan-ceset-bulundu_121560,Canlı yayında cinayet itirafı,Canlı yayında cinayet itirafı,26.10.2015
153,http://www.hurriyet.com.tr/gundem/berlinin-kadin-cinayeti-istanbula-uzandi-40005627,Berlin’in kadın cinayeti &nbsp;İstanbul’a uzandı,"Hatun Sürücü, 10 yıl önce ‘makyaj yaptığı’ gerekçesiyle küçük kardeşi tarafından öldürüldü. Katil kardeş 9 yıl hapis yattı. Diğer iki kardeş beraat etti. Almanya, iki kardeşin yeniden yargılanmasını istedi ve kardeşlere Türkiye’de dava açıldı.",24.10.2015
154,http://www.hurriyet.com.tr/gundem/pydde-1400-pkkli-var-40005623,'PYD'de 1400 PKK'lı var',"Cumhurbaşkanı Tayyip Erdoğan, dün gittiği Gaziantep’te önce Hasan Kalyoncu Üniversitesi’nde fahri doktora törenine katıldı, ardından dışarıda kendisini bekleyen vatandaşlara hitap etti, sonra da Türkiye Gençlik Vakfı’nın şölenine katıldı. Cumhurbaşkanı Erdoğan, bu temasları sırasında özetle şunları söyledi:",24.10.2015
155,http://www.hurriyet.com.tr/gundem/trtden-bile-ambargoluyum-40005615,'TRT’den bile ambargoluyum',"Eski Başbakan Yardımcısı Bülent Arınç, bakanlığı döneminde sorumlu olduğu TRT de dahil iktidara yakın televizyon kanallarının kendisine ambargo uyguladığını belirterek “Heyecanımı kaybettiğimi söyleyebilirim. Birilerine olan sevgimi de biraz kaybetmiş olabilirim. İnsan yol arkadaşlarını 
çok iyi seçmeli. Yola çıktıklarını, yolda bulduklarınla değişirsen işler yürümez” dedi.",24.10.2015
156,http://www.hurriyet.com.tr/gundem/arinc-ve-albayrak-arasinda-soz-duellosu-40005370,Arınç ve Albayrak arasında söz düellosu,"Eski Başbakan Yardımcısı Bülent Arınç ile Star Gazetesi Genel Yayın Yönetmeni Nuh Albayrak arasında söz düellosu yaşandı. CNN Türk yayına katılan Arınç’ın sözlerini Twitter üzerinden eleştiren Albayrak’a Arınç, “Valla bu nasihatları başkalarına yapsın. Onlar da Yezid kadar olmasa bile, bazı köşe yazarlarımız, Yezid'den daha fazla cinayet işliyorlar” dedi. Albayrak ise bu açıklamalara cevaben, “Sayın Arınç, ben 40 yıldır aynı çizgideyim. Düne kadar durduğum yeri taktir hatta teşvik ederken bugün yerenler “değişim”i kendinde aramalı” ifadesini kullandı.",24.10.2015
157,http://www.hurriyet.com.tr/gundem/arinc-birilerine-olan-sevgimi-biraz-kaybetmis-olabilirim-40005357,Bülent Arınç: Birilerine olan sevgimi biraz kaybetmiş olabilirim,"AK Parti'nin kurucularından Bülent Arınç, CNNTürk'te Hakan Çelik'in programına katıldı ve çok önemli açıklamalar yaptı. 'Heyecanımı kaybettiğimi de söyleyebilirim. Birilerine olan sevgimi de biraz kaybetmiş olabilirim' diyen Arınç 'İnsan yol arkadaşını çok iyi seçmeli' diye ekledi. 'Bugüne kadar söylemediğim bir şey var' diye sözüne başlayan Arınç, TRT'de dahil bir çok televizyon kanalının kendisine ambargo koyduğunu açıkladı. ",24.10.2015
158,http://www.hurriyet.com.tr/gundem/bahceliden-muharrem-ayi-mesaji-40005292,Devlet Bahçeli'den 'Muharrem Ayı' mesajı,"MHP Genel Başkanı Devlet Bahçeli, Muharrem ayı dolayısıyla Twitter hesabından mesajlar yayımladı. Bahçeli mesajında, ""Geleceği Yezidler değil, Hz. Hüseyin ahlakıyla ahlaklanmış, inançlarına samimiyetle bağlanmış, fedakarlığı pusula yapmış yürekler yazacaktır"" dedi.",23.10.2015
159,http://www.hurriyet.com.tr/gundem/develi-kebapcisindaki-asitli-saldirida-kamera-kayitlarini-hacker-mi-sildi-40004692,Develi kebapçısındaki asitli saldırıda kamera kayıtlarını 'hacker mı' sildi,Ataşehir'deki Develi kebapçısında&nbsp;önceki gün meydana gelen Avukat Işıl G.'nin 3 yaşındaki oğlu Y.K.'nın oyun yerinde üzerine asitli bir madde atılması olayında ilginç bir gelişme yaşandı.,22.10.2015
160,http://www.hurriyet.com.tr/gundem/eyupte-dehset-karisi-ve-oglunu-oldurdu-40004480,Eyüp’te dehşet; karısı ve oğlunu öldürdü ,"Eyüp'te taksi şoförü Yaşar Yılmaz karısı Fatma Yılmaz ile oğlu Hacı Yılmaz'ı tabancayla vurarak öldürdü. Yılmaz'ın alkol ve psikolojik sorunlarının olduğu iddia edilirken, mahalle esnafı Engin Hava olayla ilgili olarak, ""Ayık gezmezdi, karısı 'Bir gün beni öldürecek' diye konuşurdu"" dedi.",22.10.2015
